2007;01-301701;MOYOBAMBA;  MUNICIPALIDAD PROVINCIAL DE MOYOBAMBA;MOYOBAMBA;SAN MARTIN;220101;7.787906839;5329.96;73.15;;0.31526984;248.1248554;1;;48.37081778;65048;;5714.74
2007;04-301753;NUEVA CAJAMARCA;  MUNICIPALIDAD DISTRITAL DE NUEVA CAJAMARCA;RIOJA;SAN MARTIN;220804;6.377081716;20401.06;74.01;;0.284399946;220.9960166;1;;43.21518632;35718;;21483.06
2007;02-301760;ALBERTO LEVEAU;  MUNICIPALIDAD DISTRITAL DE ALBERTO LEVEAU;SAN MARTIN;SAN MARTIN;220902;6.443670089;179.62;71.95;;0.252461586;170.2413399;1;;42.95809806;827;;188.74
2007;05-301808;SAN JACINTO;  MUNICIPALIDAD DISTRITAL DE SAN JACINTO;TUMBES;TUMBES;240105;7.714434967;;75.56;;0.414084198;390.1784986;1;;82.09863026;7979;;868151.23
2008;01-300078;BAGUA GRANDE;  MUNICIPALIDAD PROVINCIAL DE UTCUBAMBA - BAGUA GRANDE;UTCUBAMBA;AMAZONAS;010701;6.725288647;3008.61;73.17978433;;0.348887732;406.4073703;1;;38.48760688;49766.5;;9573.7
2008;01-300097;AIJA;  MUNICIPALIDAD PROVINCIAL DE AIJA;AIJA;ANCASH;020201;8.548304733;1346221.84;65.5249228;;0.321264655;286.2608453;;1;52.03582676;2029;;1351225.1
2008;08-300117;HUALLANCA;  MUNICIPALIDAD DISTRITAL DE HUALLANCA;BOLOGNESI;ANCASH;020508;7.827611411;7631526.59;69.67961264;;0.333605515;368.9352445;;1;36.14645207;8357;;8452803.14
2008;07-300131;PARIAHUANCA;  MUNICIPALIDAD DISTRITAL DE PARIAHUANCA;CARHUAZ;ANCASH;020607;5.340954959;873003.78;73.92122245;;0.298274635;304.14242;1;;36.9450928;1538.5;;878747.06
2008;07-300156;HUACHIS;  MUNICIPALIDAD DISTRITAL DE HUACHIS;HUARI;ANCASH;021007;4.315581516;23548976.79;71.92844492;;0.212795649;146.4149057;;1;42.04758385;3755;;23605474.44
2008;19-300349;SAN JUAN DE TARUCANI;  MUNICIPALIDAD DISTRITAL DE SAN JUAN DE TARUCANI;AREQUIPA;AREQUIPA;040119;5.439028059;1543484.9;75.31260185;;0.302618404;276.9700364;1;;44.84710206;2172.5;;1743978.28
2008;24-300354;UCHUMAYO;  MUNICIPALIDAD DISTRITAL DE UCHUMAYO;AREQUIPA;AREQUIPA;040124;10.54940964;17183740.62;75.21044578;;0.503998695;588.5273528;1;;78.92995807;11073.5;;17311814.97
2008;28-300358;YURA;  MUNICIPALIDAD DISTRITAL DE YURA;AREQUIPA;AREQUIPA;040128;8.392261412;12585414.81;74.26975319;;0.433555691;435.9732926;1;;83.45119273;17601.5;;13068569.77
2008;07-300366;QUILCA;  MUNICIPALIDAD DISTRITAL DE QUILCA;CAMANA;AREQUIPA;040207;8.015383144;329452.98;76.67502747;;0.44170464;479.8077213;1;;72.76445274;787;;351809.73
2008;08-300375;CHAPARRA;  MUNICIPALIDAD DISTRITAL DE CHAPARRA;CARAVELI;AREQUIPA;040308;9.279297568;1437817;77.45272558;;0.433969349;484.3857042;;1;53.12201718;4138;;1606897.51
2008;09-300376;HUANUHUANU;  MUNICIPALIDAD DISTRITAL DE HUANUHUANU;CARAVELI;AREQUIPA;040309;8.078975367;1127755.41;78.25034688;;0.385115051;345.6487824;;1;62.07967725;2662.5;;1285704.67
2008;09-300389;ORCOPAMPA;  MUNICIPALIDAD DISTRITAL DE ORCOPAMPA;CASTILLA;AREQUIPA;040409;9.284152884;2633836.31;72.6708591;;0.423356594;536.3236286;;1;46.42393273;8629;;4804192.54
2008;04-300398;CALLALLI;  MUNICIPALIDAD DISTRITAL DE CALLALLI;CAYLLOMA;AREQUIPA;040504;6.153118755;1102352.18;73.6487814;;0.335395179;295.1898633;1;;64.81515559;2436;;1175636.1
2008;16-300410;TAPAY;  MUNICIPALIDAD DISTRITAL DE TAPAY;CAYLLOMA;AREQUIPA;040516;4.118004625;285593.21;72.52154674;;0.274782578;194.8928862;;1;99.98481227;653;;311392.53
2008;03-300417;CAYARANI;  MUNICIPALIDAD DISTRITAL DE CAYARANI;CONDESUYOS;AREQUIPA;040603;7.362327835;5270764.63;74.66046812;;0.306869135;301.468299;;1;32.23170798;3626.5;;7515740.24
2008;06-300420;RIO GRANDE;  MUNICIPALIDAD DISTRITAL DE RIO GRANDE;CONDESUYOS;AREQUIPA;040606;8.861529187;1861178.82;72.87151322;;0.461445171;535.5656068;;1;81.16863048;3335;;2387973.79
2008;06-300513;OYOLO;  MUNICIPALIDAD DISTRITAL DE OYOLO;PAUCAR DEL SARA SARA;AYACUCHO;050806;5.333838353;46029.44;69.89194259;;0.158156578;148.2864997;;1;5.677044632;1173;;49334.08
2008;05-300533;CANARIA;  MUNICIPALIDAD DISTRITAL DE CANARIA;VICTOR FAJARDO;AYACUCHO;051005;7.27790246;463957.32;71.95282909;;0.304973234;316.2906701;;1;30.77025631;4028;;701889.87
2008;08-300604;YONAN;  MUNICIPALIDAD DISTRITAL DE YONAN;CONTUMAZA;CAJAMARCA;060508;7.66189836;1218817.85;72.22205749;;0.425732943;569.8132646;1;;53.82463255;7944.5;;1261086.04
2008;09-300674;SEXI;  MUNICIPALIDAD DISTRITAL DE SEXI;SANTA CRUZ;CAJAMARCA;061309;6.709591015;41654.89;73.03627647;;0.30486366;231.3958007;1;;66.50435503;536;;41779.45
2008;07-300746;SUYCKUTAMBO;  MUNICIPALIDAD DISTRITAL DE SUYCKUTAMBO;ESPINAR;CUSCO;080807;3.862559203;3311238.35;69.51416953;;0.206165062;166.460934;;1;35.76040734;2854.5;;4526623.65
2008;06-300797;HUACHOCOLPA;  MUNICIPALIDAD DISTRITAL DE HUACHOCOLPA;HUANCAVELICA;HUANCAVELICA;090106;6.921624146;734892.79;66.34078177;;0.289401856;378.7737855;;1;25.26968619;3031.5;;979227.85
2008;04-300820;CCOCHACCASA;  MUNICIPALIDAD DISTRITAL DE CCOCHACCASA;ANGARAES;HUANCAVELICA;090304;5.105853535;134837.89;67.22098634;;0.236990843;231.4413902;;1;32.8096639;3344.5;;575071.23
2008;09-300850;SAN PEDRO DE CORIS;  MUNICIPALIDAD DISTRITAL DE SAN PEDRO DE CORIS;CHURCAMPA;HUANCAVELICA;090509;7.319467579;3706686.34;67.00532961;;0.29771411;355.7128175;;1;37.06432125;3999.5;;4989878.01
2008;03-300887;CHINCHAO;  MUNICIPALIDAD DISTRITAL DE CHINCHAO;HUANUCO;HUANUCO;100103;3.159107767;115414.16;73.05462425;;0.184023551;196.0747145;1;;15.30160904;25575;;149019.14
2008;07-300952;SAN MIGUEL DE CAURI;  MUNICIPALIDAD DISTRITAL DE SAN MIGUEL DE CAURI;LAURICOCHA;HUANUCO;101007;6.601611654;1359214.63;70.48409752;;0.266658624;226.3420709;;1;33.12279845;10009.5;;1886089.17
2008;03-300976;CHAVIN;  MUNICIPALIDAD DISTRITAL DE CHAVIN;CHINCHA;ICA;110203;7.908807551;1325208.42;76.65847975;;0.365851325;401.4861329;;1;38.08211632;1160.5;;1525691.74
2008;05-300989;VISTA ALEGRE;  MUNICIPALIDAD DISTRITAL DE VISTA ALEGRE;NASCA;ICA;110305;9.127155709;3590786.51;78.16338273;;0.442956152;430.7757557;;1;74.71821331;14108;;4237996.32
2008;05-300999;PARACAS;  MUNICIPALIDAD DISTRITAL DE PARACAS;PISCO;ICA;110505;10.07859764;509182.58;75.71409313;;0.431830219;474.9628621;1;;52.83856745;4565;1;555339.13
2008;07-301001;SAN CLEMENTE;  MUNICIPALIDAD DISTRITAL DE SAN CLEMENTE;PISCO;ICA;110507;8.846460243;1205296.73;75.5483187;;0.416574859;433.1374886;1;;59.78930714;19897.5;;1403073.48
2008;12-301010;COLCA;  MUNICIPALIDAD DISTRITAL DE COLCA;HUANCAYO;JUNIN;120112;7.477397053;131121.74;71.48764364;;0.30851962;212.6008274;1;;69.65695835;2045.5;;158383.83
2008;06-301051;VITOC;  MUNICIPALIDAD DISTRITAL DE VITOC;CHANCHAMAYO;JUNIN;120306;7.965183174;542706.48;72.54609685;;0.389715934;465.2379837;;1;51.24208792;2617;;868152.77
2008;06-301057;CURICACA;  MUNICIPALIDAD DISTRITAL DE CURICACA;JAUJA;JUNIN;120406;6.939648817;173290.54;69.98132608;;0.335270284;308.7296115;1;;62.49594791;1761.5;;204667.57
2008;05-301102;LA UNION;  MUNICIPALIDAD DISTRITAL DE LA UNION;TARMA;JUNIN;120705;7.360584599;450581.99;72.84639428;;0.363578687;339.8354706;1;;63.49152402;3778.5;;567511.91
2008;01-301108;LA OROYA;  MUNICIPALIDAD PROVINCIAL DE YAULI - LA OROYA;YAULI;JUNIN;120801;10.4561038;7721526.73;73.82214551;1;0.505879645;633.3955574;;;74.97711023;17912;;9216753.81
2008;03-301110;HUAY-HUAY;  MUNICIPALIDAD DISTRITAL DE HUAY - HUAY;YAULI;JUNIN;120803;9.708886297;4543253.58;73.97886546;;0.401401929;459.7325287;;1;44.5972154;1667.5;;6303812.14
2008;04-301111;MARCAPOMACOCHA;  MUNICIPALIDAD DISTRITAL DE MARCAPOMACOCHA;YAULI;JUNIN;120804;7.861205393;1584771.44;73.94992335;;0.358726955;346.6085493;1;;52.9871746;1293.5;;1815128.39
2008;10-301117;YAULI;  MUNICIPALIDAD DISTRITAL DE YAULI;YAULI;JUNIN;120810;10.21352965;6498533.63;73.81042561;;0.488815372;612.4199765;1;1;71.75704346;5907.5;;10430273.33
2008;01-301171;SAN PEDRO DE LLOC;  MUNICIPALIDAD PROVINCIAL DE PACASMAYO - SAN PEDRO DE LLOC;PACASMAYO;LA LIBERTAD;130701;9.830702747;1219082.21;76.49960705;;0.463137551;514.2461857;1;;64.59227913;16457;;1331035.1
2008;09-301184;PATAZ;  MUNICIPALIDAD DISTRITAL DE PATAZ;PATAZ;LA LIBERTAD;130809;7.156525796;2335090.77;70.46495891;;0.285842966;295.5953686;;1;23.86518389;7766.5;;3158466.96
2008;02-301206;LUCMA;  MUNICIPALIDAD DISTRITAL DE LUCMA;GRAN CHIMU;LA LIBERTAD;131102;5.104664943;653929.25;72.25417217;;0.196759209;155.0693421;1;;16.97471831;6056.5;;713886.37
2008;03-301211;GUADALUPITO;  MUNICIPALIDAD DISTRITAL DE GUADALUPITO;VIRU;LA LIBERTAD;131203;5.989731584;466989.58;74.6810638;;0.325230784;323.2784697;1;;43.98625414;6849.5;;514285.2
2008;04-301235;MANUEL ANTONIO MESONES MURO;  MUNICIPALIDAD DISTRITAL DE MANUEL ANTONIO MESONES MURO;FERREÑAFE;LAMBAYEQUE;140204;6.389020403;;69.07268105;;0.313587542;286.3673534;1;;56.20243078;4219;;0
2008;06-301255;CARABAYLLO;  MUNICIPALIDAD DISTRITAL DE CARABAYLLO;LIMA;LIMA;150106;10.75702024;471466.36;76.49084266;;0.499132804;573.1231962;1;;73.23892918;230231.5;;518048.24
2008;18-301267;LURIGANCHO;  MUNICIPALIDAD DISTRITAL DE LURIGANCHO (CHOSICA);LIMA;LIMA;150118;10.60683995;542365.73;76.76572372;;0.520188564;634.8683492;;;76.1192038;179666.5;1;576208.77
2008;19-301268;LURIN;  MUNICIPALIDAD DISTRITAL DE LURIN;LIMA;LIMA;150119;9.918573833;536370.87;76.58359355;;0.502860543;623.1779786;1;;70.76819117;67330.5;;617869.85
2008;23-301272;PACHACAMAC;  MUNICIPALIDAD DISTRITAL DE PACHACAMAC;LIMA;LIMA;150123;9.765927691;633610.56;76.3644846;;0.473732323;548.013678;1;;66.48387479;78105;;678096.39
2008;43-301292;VILLA MARIA DEL TRIUNFO;  MUNICIPALIDAD DISTRITAL DE VILLA MARIA DEL TRIUNFO;LIMA;LIMA;150143;10.01591045;636132.9;76.79670766;;0.505252377;611.9348623;1;;74.13308716;395132.5;;900591.99
2008;02-301312;ASIA;  MUNICIPALIDAD DISTRITAL DE ASIA;CAÑETE;LIMA;150502;8.709182726;1173067.06;76.56290023;;0.44710101;539.2609065;1;;57.75120685;7127;;1496918.34
2008;05-301315;CHILCA;  MUNICIPALIDAD DISTRITAL DE CHILCA;CAÑETE;LIMA;150505;8.810037285;1518508.9;76.91036354;;0.460778408;579.3157348;1;;57.4487257;14945;;2015073.29
2008;06-301316;COAYLLO;  MUNICIPALIDAD DISTRITAL DE COAYLLO;CAÑETE;LIMA;150506;8.875647231;192250.26;77.67453099;;0.43036631;386.1435194;;1;88.87208126;1057.5;;251167.43
2008;01-301327;HUARAL;  MUNICIPALIDAD PROVINCIAL DE HUARAL;HUARAL;LIMA;150601;8.573239688;9854210.86;77.10119972;;0.453891453;509.9675323;;1;70.06023315;91646;;11952997
2008;10-301336;SANTA CRUZ DE ANDAMARCA;  MUNICIPALIDAD DISTRITAL DE SANTA CRUZ DE ANDAMARCA;HUARAL;LIMA;150610;8.146165176;215138.14;76.16875237;;0.378087884;323.1474838;;1;69.62565077;1265.5;;253356.28
2008;05-301343;CHICLA;  MUNICIPALIDAD DISTRITAL DE CHICLA;HUAROCHIRI;LIMA;150705;8.135414947;8018786.88;71.72997424;;0.483474856;784.915076;;1;64.77298285;7363.5;;10282590.63
2008;16-301354;SAN ANTONIO;  MUNICIPALIDAD DISTRITAL DE SAN ANTONIO;HUAROCHIRI;LIMA;150716;8.080680775;2397571.54;72.11697269;;0.308963242;199.1929395;1;;71.89050212;4744.5;;2606393
2008;22-301360;SAN MATEO;  MUNICIPALIDAD DISTRITAL DE SAN MATEO;HUAROCHIRI;LIMA;150722;9.647322665;2551069.45;71.34853771;;0.447189695;523.933851;;1;70.50509972;5309.5;;2790086.08
2008;01-301371;HUACHO;  MUNICIPALIDAD PROVINCIAL DE HUAURA;HUAURA;LIMA;150801;8.973167576;2739187.54;75.80491415;;0.509651786;652.590166;1;;83.55137284;56629.5;;3297981.29
2008;01-301383;OYON;  MUNICIPALIDAD PROVINCIAL DE OYON;OYON;LIMA;150901;7.376239227;6990102.61;74.10145581;;0.40224562;473.3354538;1;1;56.838256;13231;;11643121.7
2008;18-301406;LARAOS;  MUNICIPALIDAD DISTRITAL DE LARAOS;YAUYOS;LIMA;151018;7.949122861;962530.26;71.96572316;;0.426597187;516.8230734;;1;73.35627025;940.5;;1486262.65
2008;08-301494;PUQUINA;  MUNICIPALIDAD DISTRITAL DE PUQUINA;GENERAL SANCHEZ CERRO;MOQUEGUA;180208;7.34667922;3370491.15;76.72662296;;0.394842333;407.8975198;1;;64.72659437;2927.5;;4915407.83
2008;03-301500;PACOCHA;  MUNICIPALIDAD DISTRITAL DE PACOCHA;ILO;MOQUEGUA;180303;13.29102875;493022.51;75.68522166;1;0.683298783;1132.100787;;;96.3763002;4269;1;647101.55
2008;04-301504;HUAYLLAY;  MUNICIPALIDAD DISTRITAL DE HUAYLLAY;PASCO;PASCO;190104;9.744249015;25066797.1;71.72956816;;0.442876145;544.2970057;;1;66.16879868;10859.5;;29468411.57
2008;08-301508;SAN FRANCISCO DE ASIS DE YARUSYACAN;  MUNICIPALIDAD DISTRITAL DE SAN FRANCISCO DE ASIS DE YARUSYACAN;PASCO;PASCO;190108;8.440153589;19426407.62;72.40007754;;0.342671684;277.2016773;;1;71.14686857;11075.5;;22502283.17
2008;13-301513;YANACANCHA;  MUNICIPALIDAD DISTRITAL DE YANACANCHA;PASCO;PASCO;190113;11.14930412;25765323.66;73.36325538;;0.460438419;461.9939735;;1;82.86943373;30038;;28730107.02
2008;01-301566;PAITA;  MUNICIPALIDAD PROVINCIAL DE PAITA;PAITA;PIURA;200501;8.880838673;455.12;73.95696143;;0.45743032;571.368468;1;;60.50353049;76749;;17624636.94
2008;02-301567;AMOTAPE;  MUNICIPALIDAD DISTRITAL DE AMOTAPE;PAITA;PIURA;200502;6.623663276;129.88;73.91235524;;0.373845587;398.3970891;1;;57.7142301;2331;;518785.78
2008;01-301587;SECHURA;  MUNICIPALIDAD PROVINCIAL DE SECHURA;SECHURA;PIURA;200801;7.387088273;1815.8;69.60556288;;0.373416425;445.4992088;1;;46.55845136;34972;;12977324
2008;02-301664;ANTAUTA;  MUNICIPALIDAD DISTRITAL DE ANTAUTA;MELGAR;PUNO;210802;6.533837711;5273223.66;67.23664595;;0.312630239;324.0933444;;1;49.05382707;4977.5;;12630651.67
2008;04-301684;CARACOTO;  MUNICIPALIDAD DISTRITAL DE CARACOTO;SAN ROMAN;PUNO;211104;4.561068978;438967.19;70.43556016;;0.224864805;161.7652735;1;;45.97154956;6068;;635124.68
2008;06-301690;QUIACA;  MUNICIPALIDAD DISTRITAL DE QUIACA;SANDIA;PUNO;211206;5.816134716;185705.69;67.47337191;;0.192169379;113.3119684;;1;36.0762551;2289;;252330.26
2008;01-301701;MOYOBAMBA;  MUNICIPALIDAD PROVINCIAL DE MOYOBAMBA;MOYOBAMBA;SAN MARTIN;220101;7.85309765;14183.43;73.31598399;;0.361908288;369.3927858;1;;48.37182752;68829.5;;14656.96
2008;04-301753;NUEVA CAJAMARCA;  MUNICIPALIDAD DISTRITAL DE NUEVA CAJAMARCA;RIOJA;SAN MARTIN;220804;6.501918961;66824.41;74.43378063;;0.323840274;313.5303256;1;;43.21643007;37736;;68290.52
2008;02-301760;ALBERTO LEVEAU;  MUNICIPALIDAD DISTRITAL DE ALBERTO LEVEAU;SAN MARTIN;SAN MARTIN;220902;6.49518184;275.63;72.2380557;;0.296249632;264.0582882;1;;42.95892225;808;;286.23
2008;05-301808;SAN JACINTO;  MUNICIPALIDAD DISTRITAL DE SAN JACINTO;TUMBES;TUMBES;240105;7.732214373;;76.75448336;;0.442480794;459.3526455;1;;82.7159818;8247.5;;1166000.76
2009;01-300078;BAGUA GRANDE;  MUNICIPALIDAD PROVINCIAL DE UTCUBAMBA - BAGUA GRANDE;UTCUBAMBA;AMAZONAS;010701;6.725288647;12443.71;73.17978433;;0.348887732;406.4073703;1;;38.48760688;49766.5;;13665.24
2009;01-300097;AIJA;  MUNICIPALIDAD PROVINCIAL DE AIJA;AIJA;ANCASH;020201;8.548304733;817041.41;65.5249228;;0.321264655;286.2608453;;1;52.03582676;2029;;818862.32
2009;08-300117;HUALLANCA;  MUNICIPALIDAD DISTRITAL DE HUALLANCA;BOLOGNESI;ANCASH;020508;7.827611411;3484320.8;69.67961264;;0.333605515;368.9352445;;1;36.14645207;8357;;3806976.01
2009;07-300131;PARIAHUANCA;  MUNICIPALIDAD DISTRITAL DE PARIAHUANCA;CARHUAZ;ANCASH;020607;5.340954959;567588.91;73.92122245;;0.298274635;304.14242;1;;36.9450928;1538.5;;573273.76
2009;07-300156;HUACHIS;  MUNICIPALIDAD DISTRITAL DE HUACHIS;HUARI;ANCASH;021007;4.315581516;15060130.66;71.92844492;;0.212795649;146.4149057;;1;42.04758385;3755;;15064803.49
2009;19-300349;SAN JUAN DE TARUCANI;  MUNICIPALIDAD DISTRITAL DE SAN JUAN DE TARUCANI;AREQUIPA;AREQUIPA;040119;5.439028059;1938923.43;75.31260185;;0.302618404;276.9700364;1;;44.84710206;2172.5;;2152988.67
2009;24-300354;UCHUMAYO;  MUNICIPALIDAD DISTRITAL DE UCHUMAYO;AREQUIPA;AREQUIPA;040124;10.54940964;21608551.93;75.21044578;;0.503998695;588.5273528;1;;78.92995807;11073.5;;21777397.68
2009;28-300358;YURA;  MUNICIPALIDAD DISTRITAL DE YURA;AREQUIPA;AREQUIPA;040128;8.392261412;15188684.27;74.26975319;;0.433555691;435.9732926;1;;83.45119273;17601.5;;15760016.46
2009;07-300366;QUILCA;  MUNICIPALIDAD DISTRITAL DE QUILCA;CAMANA;AREQUIPA;040207;8.015383144;382436.56;76.67502747;;0.44170464;479.8077213;1;;72.76445274;787;;410978.9
2009;08-300375;CHAPARRA;  MUNICIPALIDAD DISTRITAL DE CHAPARRA;CARAVELI;AREQUIPA;040308;9.279297568;1637758.03;77.45272558;;0.433969349;484.3857042;;1;53.12201718;4138;;1822339.97
2009;09-300376;HUANUHUANU;  MUNICIPALIDAD DISTRITAL DE HUANUHUANU;CARAVELI;AREQUIPA;040309;8.078975367;1407006.12;78.25034688;;0.385115051;345.6487824;;1;62.07967725;2662.5;;1584592.35
2009;09-300389;ORCOPAMPA;  MUNICIPALIDAD DISTRITAL DE ORCOPAMPA;CASTILLA;AREQUIPA;040409;9.284152884;1820626.47;72.6708591;;0.423356594;536.3236286;;1;46.42393273;8629;;4657928.65
2009;04-300398;CALLALLI;  MUNICIPALIDAD DISTRITAL DE CALLALLI;CAYLLOMA;AREQUIPA;040504;6.153118755;1247933.28;73.6487814;;0.335395179;295.1898633;1;;64.81515559;2436;;1348172.66
2009;16-300410;TAPAY;  MUNICIPALIDAD DISTRITAL DE TAPAY;CAYLLOMA;AREQUIPA;040516;4.118004625;323565.24;72.52154674;;0.274782578;194.8928862;;1;99.98481227;653;;349552.95
2009;03-300417;CAYARANI;  MUNICIPALIDAD DISTRITAL DE CAYARANI;CONDESUYOS;AREQUIPA;040603;7.362327835;2390708.45;74.66046812;;0.306869135;301.468299;;1;32.23170798;3626.5;;5022169.78
2009;06-300420;RIO GRANDE;  MUNICIPALIDAD DISTRITAL DE RIO GRANDE;CONDESUYOS;AREQUIPA;040606;8.861529187;1268342.17;72.87151322;;0.461445171;535.5656068;;1;81.16863048;3335;;1684068.24
2009;06-300513;OYOLO;  MUNICIPALIDAD DISTRITAL DE OYOLO;PAUCAR DEL SARA SARA;AYACUCHO;050806;5.333838353;10273.13;69.89194259;;0.158156578;148.2864997;;1;5.677044632;1173;;16737.36
2009;05-300533;CANARIA;  MUNICIPALIDAD DISTRITAL DE CANARIA;VICTOR FAJARDO;AYACUCHO;051005;7.27790246;290861.7;71.95282909;;0.304973234;316.2906701;;1;30.77025631;4028;;471091.09
2009;08-300604;YONAN;  MUNICIPALIDAD DISTRITAL DE YONAN;CONTUMAZA;CAJAMARCA;060508;7.66189836;1021244.33;72.22205749;;0.425732943;569.8132646;1;;53.82463255;7944.5;;1088731.27
2009;09-300674;SEXI;  MUNICIPALIDAD DISTRITAL DE SEXI;SANTA CRUZ;CAJAMARCA;061309;6.709591015;51812.49;73.03627647;;0.30486366;231.3958007;1;;66.50435503;536;;55305.75
2009;07-300746;SUYCKUTAMBO;  MUNICIPALIDAD DISTRITAL DE SUYCKUTAMBO;ESPINAR;CUSCO;080807;3.862559203;1847070.38;69.51416953;;0.206165062;166.460934;;1;35.76040734;2854.5;;2903170.6
2009;06-300797;HUACHOCOLPA;  MUNICIPALIDAD DISTRITAL DE HUACHOCOLPA;HUANCAVELICA;HUANCAVELICA;090106;6.921624146;212564.43;66.34078177;;0.289401856;378.7737855;;1;25.26968619;3031.5;;416730.38
2009;04-300820;CCOCHACCASA;  MUNICIPALIDAD DISTRITAL DE CCOCHACCASA;ANGARAES;HUANCAVELICA;090304;5.105853535;48619.82;67.22098634;;0.236990843;231.4413902;;1;32.8096639;3344.5;;423196.33
2009;09-300850;SAN PEDRO DE CORIS;  MUNICIPALIDAD DISTRITAL DE SAN PEDRO DE CORIS;CHURCAMPA;HUANCAVELICA;090509;7.319467579;1384133.7;67.00532961;;0.29771411;355.7128175;;1;37.06432125;3999.5;;1803461.38
2009;03-300887;CHINCHAO;  MUNICIPALIDAD DISTRITAL DE CHINCHAO;HUANUCO;HUANUCO;100103;3.159107767;41730.66;73.05462425;;0.184023551;196.0747145;1;;15.30160904;25575;;56284.04
2009;07-300952;SAN MIGUEL DE CAURI;  MUNICIPALIDAD DISTRITAL DE SAN MIGUEL DE CAURI;LAURICOCHA;HUANUCO;101007;6.601611654;324223.28;70.48409752;;0.266658624;226.3420709;;1;33.12279845;10009.5;;577896.22
2009;03-300976;CHAVIN;  MUNICIPALIDAD DISTRITAL DE CHAVIN;CHINCHA;ICA;110203;7.908807551;1678716.28;76.65847975;;0.365851325;401.4861329;;1;38.08211632;1160.5;;1688783.4
2009;05-300989;VISTA ALEGRE;  MUNICIPALIDAD DISTRITAL DE VISTA ALEGRE;NASCA;ICA;110305;9.127155709;5975517.55;78.16338273;;0.442956152;430.7757557;;1;74.71821331;14108;;6417700.02
2009;05-300999;PARACAS;  MUNICIPALIDAD DISTRITAL DE PARACAS;PISCO;ICA;110505;10.07859764;945839.9;75.71409313;;0.431830219;474.9628621;1;;52.83856745;4565;1;1004201.95
2009;07-301001;SAN CLEMENTE;  MUNICIPALIDAD DISTRITAL DE SAN CLEMENTE;PISCO;ICA;110507;8.846460243;1980493.01;75.5483187;;0.416574859;433.1374886;1;;59.78930714;19897.5;;2122679.14
2009;12-301010;COLCA;  MUNICIPALIDAD DISTRITAL DE COLCA;HUANCAYO;JUNIN;120112;7.477397053;45088.86;71.48764364;;0.30851962;212.6008274;1;;69.65695835;2045.5;;68453.84
2009;06-301051;VITOC;  MUNICIPALIDAD DISTRITAL DE VITOC;CHANCHAMAYO;JUNIN;120306;7.965183174;43170.72;72.54609685;;0.389715934;465.2379837;;1;51.24208792;2617;;167486.6
2009;06-301057;CURICACA;  MUNICIPALIDAD DISTRITAL DE CURICACA;JAUJA;JUNIN;120406;6.939648817;51189.82;69.98132608;;0.335270284;308.7296115;1;;62.49594791;1761.5;;71873.31
2009;05-301102;LA UNION;  MUNICIPALIDAD DISTRITAL DE LA UNION;TARMA;JUNIN;120705;7.360584599;311597.89;72.84639428;;0.363578687;339.8354706;1;;63.49152402;3778.5;;409669.3
2009;01-301108;LA OROYA;  MUNICIPALIDAD PROVINCIAL DE YAULI - LA OROYA;YAULI;JUNIN;120801;10.4561038;2307738.95;73.82214551;1;0.505879645;633.3955574;;;74.97711023;17912;;3447283.61
2009;03-301110;HUAY-HUAY;  MUNICIPALIDAD DISTRITAL DE HUAY - HUAY;YAULI;JUNIN;120803;9.708886297;1531836.78;73.97886546;;0.401401929;459.7325287;;1;44.5972154;1667.5;;2842985.09
2009;04-301111;MARCAPOMACOCHA;  MUNICIPALIDAD DISTRITAL DE MARCAPOMACOCHA;YAULI;JUNIN;120804;7.861205393;474458.58;73.94992335;;0.358726955;346.6085493;1;;52.9871746;1293.5;;708839.51
2009;10-301117;YAULI;  MUNICIPALIDAD DISTRITAL DE YAULI;YAULI;JUNIN;120810;10.21352965;2863921.01;73.81042561;;0.488815372;612.4199765;1;1;71.75704346;5907.5;;5252435.97
2009;01-301171;SAN PEDRO DE LLOC;  MUNICIPALIDAD PROVINCIAL DE PACASMAYO - SAN PEDRO DE LLOC;PACASMAYO;LA LIBERTAD;130701;9.830702747;1621892.24;76.49960705;;0.463137551;514.2461857;1;;64.59227913;16457;;1742046.53
2009;09-301184;PATAZ;  MUNICIPALIDAD DISTRITAL DE PATAZ;PATAZ;LA LIBERTAD;130809;7.156525796;2967211.82;70.46495891;;0.285842966;295.5953686;;1;23.86518389;7766.5;;4135315.9
2009;02-301206;LUCMA;  MUNICIPALIDAD DISTRITAL DE LUCMA;GRAN CHIMU;LA LIBERTAD;131102;5.104664943;914259.77;72.25417217;;0.196759209;155.0693421;1;;16.97471831;6056.5;;981993.34
2009;03-301211;GUADALUPITO;  MUNICIPALIDAD DISTRITAL DE GUADALUPITO;VIRU;LA LIBERTAD;131203;5.989731584;652125.89;74.6810638;;0.325230784;323.2784697;1;;43.98625414;6849.5;;700500.89
2009;04-301235;MANUEL ANTONIO MESONES MURO;  MUNICIPALIDAD DISTRITAL DE MANUEL ANTONIO MESONES MURO;FERREÑAFE;LAMBAYEQUE;140204;6.389020403;728.1;69.07268105;;0.313587542;286.3673534;1;;56.20243078;4219;;728.1
2009;06-301255;CARABAYLLO;  MUNICIPALIDAD DISTRITAL DE CARABAYLLO;LIMA;LIMA;150106;10.75702024;395805.85;76.49084266;;0.499132804;573.1231962;1;;73.23892918;230231.5;;434268.97
2009;18-301267;LURIGANCHO;  MUNICIPALIDAD DISTRITAL DE LURIGANCHO (CHOSICA);LIMA;LIMA;150118;10.60683995;503924.47;76.76572372;;0.520188564;634.8683492;;;76.1192038;179666.5;1;544430.34
2009;19-301268;LURIN;  MUNICIPALIDAD DISTRITAL DE LURIN;LIMA;LIMA;150119;9.918573833;264399.24;76.58359355;;0.502860543;623.1779786;1;;70.76819117;67330.5;;323240.42
2009;23-301272;PACHACAMAC;  MUNICIPALIDAD DISTRITAL DE PACHACAMAC;LIMA;LIMA;150123;9.765927691;604981.16;76.3644846;;0.473732323;548.013678;1;;66.48387479;78105;;641987.75
2009;43-301292;VILLA MARIA DEL TRIUNFO;  MUNICIPALIDAD DISTRITAL DE VILLA MARIA DEL TRIUNFO;LIMA;LIMA;150143;10.01591045;886717.52;76.79670766;;0.505252377;611.9348623;1;;74.13308716;395132.5;;1096438.74
2009;02-301312;ASIA;  MUNICIPALIDAD DISTRITAL DE ASIA;CAÑETE;LIMA;150502;8.709182726;444027.28;76.56290023;;0.44710101;539.2609065;1;;57.75120685;7127;;544893.91
2009;05-301315;CHILCA;  MUNICIPALIDAD DISTRITAL DE CHILCA;CAÑETE;LIMA;150505;8.810037285;700089.73;76.91036354;;0.460778408;579.3157348;1;;57.4487257;14945;;902182.41
2009;06-301316;COAYLLO;  MUNICIPALIDAD DISTRITAL DE COAYLLO;CAÑETE;LIMA;150506;8.875647231;74034.43;77.67453099;;0.43036631;386.1435194;;1;88.87208126;1057.5;;97136.78
2009;01-301327;HUARAL;  MUNICIPALIDAD PROVINCIAL DE HUARAL;HUARAL;LIMA;150601;8.573239688;5270649.12;77.10119972;;0.453891453;509.9675323;;1;70.06023315;91646;;6130087.66
2009;10-301336;SANTA CRUZ DE ANDAMARCA;  MUNICIPALIDAD DISTRITAL DE SANTA CRUZ DE ANDAMARCA;HUARAL;LIMA;150610;8.146165176;92837.02;76.16875237;;0.378087884;323.1474838;;1;69.62565077;1265.5;;111236.47
2009;05-301343;CHICLA;  MUNICIPALIDAD DISTRITAL DE CHICLA;HUAROCHIRI;LIMA;150705;8.135414947;686318.26;71.72997424;;0.483474856;784.915076;;1;64.77298285;7363.5;;1546812.4
2009;16-301354;SAN ANTONIO;  MUNICIPALIDAD DISTRITAL DE SAN ANTONIO;HUAROCHIRI;LIMA;150716;8.080680775;434791;72.11697269;;0.308963242;199.1929395;1;;71.89050212;4744.5;;579634.69
2009;22-301360;SAN MATEO;  MUNICIPALIDAD DISTRITAL DE SAN MATEO;HUAROCHIRI;LIMA;150722;9.647322665;175909.55;71.34853771;;0.447189695;523.933851;;1;70.50509972;5309.5;;249681.57
2009;01-301371;HUACHO;  MUNICIPALIDAD PROVINCIAL DE HUAURA;HUAURA;LIMA;150801;8.973167576;1115970.64;75.80491415;;0.509651786;652.590166;1;;83.55137284;56629.5;;1354393.93
2009;01-301383;OYON;  MUNICIPALIDAD PROVINCIAL DE OYON;OYON;LIMA;150901;7.376239227;855524.45;74.10145581;;0.40224562;473.3354538;1;1;56.838256;13231;;2946220.3
2009;18-301406;LARAOS;  MUNICIPALIDAD DISTRITAL DE LARAOS;YAUYOS;LIMA;151018;7.949122861;900277.42;71.96572316;;0.426597187;516.8230734;;1;73.35627025;940.5;;1287168.89
2009;08-301494;PUQUINA;  MUNICIPALIDAD DISTRITAL DE PUQUINA;GENERAL SANCHEZ CERRO;MOQUEGUA;180208;7.34667922;6014653.13;76.72662296;;0.394842333;407.8975198;1;;64.72659437;2927.5;;6935860.52
2009;03-301500;PACOCHA;  MUNICIPALIDAD DISTRITAL DE PACOCHA;ILO;MOQUEGUA;180303;13.29102875;901543.02;75.68522166;1;0.683298783;1132.100787;;;96.3763002;4269;1;1036726.72
2009;04-301504;HUAYLLAY;  MUNICIPALIDAD DISTRITAL DE HUAYLLAY;PASCO;PASCO;190104;9.744249015;7104823.13;71.72956816;;0.442876145;544.2970057;;1;66.16879868;10859.5;;9560030.54
2009;08-301508;SAN FRANCISCO DE ASIS DE YARUSYACAN;  MUNICIPALIDAD DISTRITAL DE SAN FRANCISCO DE ASIS DE YARUSYACAN;PASCO;PASCO;190108;8.440153589;5716231.52;72.40007754;;0.342671684;277.2016773;;1;71.14686857;11075.5;;7433545.58
2009;13-301513;YANACANCHA;  MUNICIPALIDAD DISTRITAL DE YANACANCHA;PASCO;PASCO;190113;11.14930412;7013365.39;73.36325538;;0.460438419;461.9939735;;1;82.86943373;30038;;8623285.29
2009;01-301566;PAITA;  MUNICIPALIDAD PROVINCIAL DE PAITA;PAITA;PIURA;200501;8.880838673;1059.19;73.95696143;;0.45743032;571.368468;1;;60.50353049;76749;;10999621.4
