2015;05-301343;CHICLA;  MUNICIPALIDAD DISTRITAL DE CHICLA;HUAROCHIRI;LIMA;150705;10.24202235;894397.16;71.59498878;;0.681627136;1629.264051;;1;66.87449181;7632;;3236501.71
2015;16-301354;SAN ANTONIO;  MUNICIPALIDAD DISTRITAL DE SAN ANTONIO;HUAROCHIRI;LIMA;150716;7.588596019;394192.19;71.48389907;;0.381863954;404.3042639;1;;56.45854694;5469;;860998.42
2015;22-301360;SAN MATEO;  MUNICIPALIDAD DISTRITAL DE SAN MATEO;HUAROCHIRI;LIMA;150722;9.13567477;156709.55;70.46617656;;0.557610896;1000.463052;;1;66.05777578;5017;;310477.56
2015;01-301371;HUACHO;  MUNICIPALIDAD PROVINCIAL DE HUAURA;HUAURA;LIMA;150801;11.87939353;1569294.78;78.59102575;;0.675672531;1163.680934;1;;80.1459083;58532;;2228861.12
2015;01-301383;OYON;  MUNICIPALIDAD PROVINCIAL DE OYON;OYON;LIMA;150901;9.258370135;1055919.63;83.18392058;;0.587392708;981.7846261;1;1;56.3694382;14479;;3935468.28
2015;18-301406;LARAOS;  MUNICIPALIDAD DISTRITAL DE LARAOS;YAUYOS;LIMA;151018;9.303392776;959201.38;79.04841105;;0.589343786;988.1187487;;1;65.36110336;762;;1835789.31
2015;08-301494;PUQUINA;  MUNICIPALIDAD DISTRITAL DE PUQUINA;GENERAL SANCHEZ CERRO;MOQUEGUA;180208;7.379302782;2659430.83;81.44757613;;0.498005975;660.4373038;1;;68.13871289;2521;;3274712.94
2015;03-301500;PACOCHA;  MUNICIPALIDAD DISTRITAL DE PACOCHA;ILO;MOQUEGUA;180303;13.00713154;388436.12;79.74317239;1;0.76178839;1489.087609;;;85.48604974;3498;1;477670.78
2015;04-301504;HUAYLLAY;  MUNICIPALIDAD DISTRITAL DE HUAYLLAY;PASCO;PASCO;190104;10.12463307;5069128.03;69.30580809;;0.563765008;944.7401385;;1;73.73815307;11412;;11293849.49
2015;08-301508;SAN FRANCISCO DE ASIS DE YARUSYACAN;  MUNICIPALIDAD DISTRITAL DE SAN FRANCISCO DE ASIS DE YARUSYACAN;PASCO;PASCO;190108;8.809014952;2935172.12;73.31548685;;0.508406363;690.5353843;;1;76.29016778;9901;;5557711.08
2015;13-301513;YANACANCHA;  MUNICIPALIDAD DISTRITAL DE YANACANCHA;PASCO;PASCO;190113;11.31675921;2225624.82;77.00264763;;0.578542657;780.1105252;;1;81.51839438;30570;;4208184.48
2015;01-301566;PAITA;  MUNICIPALIDAD PROVINCIAL DE PAITA;PAITA;PIURA;200501;8.523965585;329.75;77.35108705;;0.528314875;805.2488747;1;;61.77925844;93147;;26486461.34
2015;02-301567;AMOTAPE;  MUNICIPALIDAD DISTRITAL DE AMOTAPE;PAITA;PIURA;200502;6.715122665;106.45;78.83702696;;0.468244249;653.8500288;1;;60.00564043;2310;;894517.84
2015;01-301587;SECHURA;  MUNICIPALIDAD PROVINCIAL DE SECHURA;SECHURA;PIURA;200801;7.402069448;20.57;68.61531998;;0.435029396;654.7514263;1;;51.43688207;42974;;14372143.6
2015;02-301664;ANTAUTA;  MUNICIPALIDAD DISTRITAL DE ANTAUTA;MELGAR;PUNO;210802;7.691558597;3657999.9;70.05425455;;0.479384112;765.8128513;;1;59.02178497;4516;;6029433.23
2015;04-301684;CARACOTO;  MUNICIPALIDAD DISTRITAL DE CARACOTO;SAN ROMAN;PUNO;211104;5.228187044;307912.08;73.27319396;;0.322594712;318.2711266;1;;54.61185874;5655;;371830.51
2015;06-301690;QUIACA;  MUNICIPALIDAD DISTRITAL DE QUIACA;SANDIA;PUNO;211206;6.289563214;456712.11;68.40908073;;0.347371907;373.1203794;;1;56.42673034;2374;;623937.15
2015;01-301701;MOYOBAMBA;  MUNICIPALIDAD PROVINCIAL DE MOYOBAMBA;MOYOBAMBA;SAN MARTIN;220101;7.755031149;27905.94;73.43386431;;0.478651071;746.3385133;1;;52.84500885;83475;;38140.6
2015;04-301753;NUEVA CAJAMARCA;  MUNICIPALIDAD DISTRITAL DE NUEVA CAJAMARCA;RIOJA;SAN MARTIN;220804;6.315555725;94572.04;75.4325831;;0.435306741;658.1130454;1;;47.39469484;45241;;125149.66
2015;02-301760;ALBERTO LEVEAU;  MUNICIPALIDAD DISTRITAL DE ALBERTO LEVEAU;SAN MARTIN;SAN MARTIN;220902;6.546854798;335.4;72.71453017;;0.399123288;535.375892;1;;46.40524795;673;;465.16
2015;05-301808;SAN JACINTO;  MUNICIPALIDAD DISTRITAL DE SAN JACINTO;TUMBES;TUMBES;240105;8.032561546;;80.56171373;;0.536264292;739.1779642;1;;77.43107136;8541;;2263090
2016;01-300078;BAGUA GRANDE;  MUNICIPALIDAD PROVINCIAL DE UTCUBAMBA - BAGUA GRANDE;UTCUBAMBA;AMAZONAS;010701;6.731035407;0.6;73.93038482;;0.469724324;749.1839399;1;;55.78650284;52189;;3.14
2016;01-300097;AIJA;  MUNICIPALIDAD PROVINCIAL DE AIJA;AIJA;ANCASH;020201;8.650866143;262029.32;58.46609631;;0.424409023;679.4138107;;1;58.53429956;1945;;311073.48
2016;08-300117;HUALLANCA;  MUNICIPALIDAD DISTRITAL DE HUALLANCA;BOLOGNESI;ANCASH;020508;7.1912106;1106327.87;66.39218026;;0.419299564;706.3960222;;1;40.87756178;7344;;1598319.54
2016;07-300131;PARIAHUANCA;  MUNICIPALIDAD DISTRITAL DE PARIAHUANCA;CARHUAZ;ANCASH;020607;5.468049851;212406.98;85.4735284;;0.398908296;432.1189666;1;;59.66318669;1495;;257681.49
2016;07-300156;HUACHIS;  MUNICIPALIDAD DISTRITAL DE HUACHIS;HUARI;ANCASH;021007;5.124042493;5199201.13;78.57210054;;0.319807041;338.0794301;;1;39.90091659;3408;;6404920.67
2016;19-300349;SAN JUAN DE TARUCANI;  MUNICIPALIDAD DISTRITAL DE SAN JUAN DE TARUCANI;AREQUIPA;AREQUIPA;040119;5.609766793;74318.86;84.1810702;;0.460853355;630.2553275;1;;64.69971089;1778;;1221386.07
2016;24-300354;UCHUMAYO;  MUNICIPALIDAD DISTRITAL DE UCHUMAYO;AREQUIPA;AREQUIPA;040124;10.22416166;257974.15;81.53469217;;0.63890529;1034.741635;1;;78.69230656;13245;;11221358.87
2016;28-300358;YURA;  MUNICIPALIDAD DISTRITAL DE YURA;AREQUIPA;AREQUIPA;040128;8.53649304;739346.87;78.17327859;;0.574751762;897.6808739;1;;79.75255608;29356.5;;13774653.48
2016;07-300366;QUILCA;  MUNICIPALIDAD DISTRITAL DE QUILCA;CAMANA;AREQUIPA;040207;8.244732179;10849.55;86.97300442;;0.530355137;674.8712149;1;;68.25997104;802;;184185.73
2016;08-300375;CHAPARRA;  MUNICIPALIDAD DISTRITAL DE CHAPARRA;CARAVELI;AREQUIPA;040308;8.918960313;612876.15;88.77703524;;0.64413807;1172.764327;;1;59.90449936;4526.5;;2026922.55
2016;09-300376;HUANUHUANU;  MUNICIPALIDAD DISTRITAL DE HUANUHUANU;CARAVELI;AREQUIPA;040309;8.395090764;616565.66;92.1974256;;0.666617911;1271.565304;;1;61.87769614;3152.5;;1676545.76
2016;09-300389;ORCOPAMPA;  MUNICIPALIDAD DISTRITAL DE ORCOPAMPA;CASTILLA;AREQUIPA;040409;8.740848855;52399.58;78.49881703;;0.553467755;1030.801502;;1;45.45291351;8919;;1727506.83
2016;04-300398;CALLALLI;  MUNICIPALIDAD DISTRITAL DE CALLALLI;CAYLLOMA;AREQUIPA;040504;5.539240845;68098.48;84.61240359;;0.476222035;750.6949977;1;;55.54779399;1730.5;;605325.5
2016;16-300410;TAPAY;  MUNICIPALIDAD DISTRITAL DE TAPAY;CAYLLOMA;AREQUIPA;040516;6.865640693;18011.99;81.1657084;;0.555582693;1043.055419;;1;63.02578619;658.5;;160092.59
2016;03-300417;CAYARANI;  MUNICIPALIDAD DISTRITAL DE CAYARANI;CONDESUYOS;AREQUIPA;040603;7.336988293;178397.33;91.48312301;;0.574806023;1153.684238;;1;37.65449177;3185.5;;2445635.16
2016;06-300420;RIO GRANDE;  MUNICIPALIDAD DISTRITAL DE RIO GRANDE;CONDESUYOS;AREQUIPA;040606;8.669941072;111558.82;74.68016689;;0.622491407;1257.33175;;1;72.1735417;3007;;733809.28
2016;06-300513;OYOLO;  MUNICIPALIDAD DISTRITAL DE OYOLO;PAUCAR DEL SARA SARA;AYACUCHO;050806;7.909780202;15176.68;59.72120135;;0.369712509;620.0917975;;1;33.88372378;1324;;579294.14
2016;05-300533;CANARIA;  MUNICIPALIDAD DISTRITAL DE CANARIA;VICTOR FAJARDO;AYACUCHO;051005;7.233078675;36362.41;73.54932039;;0.461375385;691.0652192;;1;55.01513956;3987;;143681.53
2016;08-300604;YONAN;  MUNICIPALIDAD DISTRITAL DE YONAN;CONTUMAZA;CAJAMARCA;060508;7.537034539;595246.28;72.51788669;;0.498140306;813.987224;1;;60.6306028;7312.5;;797558.92
2016;09-300674;SEXI;  MUNICIPALIDAD DISTRITAL DE SEXI;SANTA CRUZ;CAJAMARCA;061309;6.879816829;90672.15;76.59020404;;0.501832949;716.5363959;1;;80.80685433;495.5;;113324.2
2016;07-300746;SUYCKUTAMBO;  MUNICIPALIDAD DISTRITAL DE SUYCKUTAMBO;ESPINAR;CUSCO;080807;3.401345493;600340.05;73.04814373;;0.292057905;338.053307;;1;59.3873892;2205.5;;3108882.18
2016;06-300797;HUACHOCOLPA;  MUNICIPALIDAD DISTRITAL DE HUACHOCOLPA;HUANCAVELICA;HUANCAVELICA;090106;6.216177602;247.26;65.11608543;;0.414920748;764.3420083;;1;42.54178195;2379;;240898.2
2016;04-300820;CCOCHACCASA;  MUNICIPALIDAD DISTRITAL DE CCOCHACCASA;ANGARAES;HUANCAVELICA;090304;5.627369885;201.76;64.44092506;;0.347951512;460.8382695;;1;51.45060021;2846.5;;325439.64
2016;09-300850;SAN PEDRO DE CORIS;  MUNICIPALIDAD DISTRITAL DE SAN PEDRO DE CORIS;CHURCAMPA;HUANCAVELICA;090509;6.7615423;372.99;58.81605374;;0.416735429;756.7732387;;1;55.6176995;3930.5;;372017.73
2016;03-300887;CHINCHAO;  MUNICIPALIDAD DISTRITAL DE CHINCHAO;HUANUCO;HUANUCO;100103;3.518984858;172.28;78.73893755;;0.279202188;326.1026547;1;;35.55956258;19498.5;;19251.68
2016;07-300952;SAN MIGUEL DE CAURI;  MUNICIPALIDAD DISTRITAL DE SAN MIGUEL DE CAURI;LAURICOCHA;HUANUCO;101007;7.586229092;131.42;67.97889853;;0.443548662;744.6914619;;1;45.05197123;8069.5;;546432.4
2016;03-300976;CHAVIN;  MUNICIPALIDAD DISTRITAL DE CHAVIN;CHINCHA;ICA;110203;10.16861283;3958156.75;80.5021052;;0.58292417;1044.861899;;1;46.92451827;1744;;3972690.6
2016;05-300989;VISTA ALEGRE;  MUNICIPALIDAD DISTRITAL DE VISTA ALEGRE;NASCA;ICA;110305;9.20769744;1565200.71;85.80298135;;0.58768519;842.0320485;;1;72.43653894;17939.5;;2158791.6
2016;05-300999;PARACAS;  MUNICIPALIDAD DISTRITAL DE PARACAS;PISCO;ICA;110505;9.722049135;346528.83;76.23301043;;0.600066983;1086.496894;1;;63.79103677;7078;1;491140.81
2016;07-301001;SAN CLEMENTE;  MUNICIPALIDAD DISTRITAL DE SAN CLEMENTE;PISCO;ICA;110507;8.825090143;890508.73;76.16254702;;0.545086777;838.8957982;1;;69.0999246;23305;;1077843.35
2016;12-301010;COLCA;  MUNICIPALIDAD DISTRITAL DE COLCA;HUANCAYO;JUNIN;120112;6.05487951;27471.36;70.96531851;;0.447193714;772.1639633;1;;55.1339187;1535;;52156.03
2016;06-301051;VITOC;  MUNICIPALIDAD DISTRITAL DE VITOC;CHANCHAMAYO;JUNIN;120306;7.184159897;16147.63;72.18787856;;0.500468751;890.0943153;;1;55.7956266;1840;;226074.27
2016;06-301057;CURICACA;  MUNICIPALIDAD DISTRITAL DE CURICACA;JAUJA;JUNIN;120406;6.857597827;30888.46;66.13514003;;0.425709482;653.760127;1;;56.92384167;1527.5;;50338.97
2016;05-301102;LA UNION;  MUNICIPALIDAD DISTRITAL DE LA UNION;TARMA;JUNIN;120705;7.564862164;36151.21;78.13504721;;0.491223401;641.9195625;1;;73.04081521;3369.5;;256253.88
2016;01-301108;LA OROYA;  MUNICIPALIDAD PROVINCIAL DE YAULI - LA OROYA;YAULI;JUNIN;120801;9.924390503;1417157.06;75.69038;1;0.574757627;898.0456213;;;72.1997727;13829;;2451590.65
2016;03-301110;HUAY-HUAY;  MUNICIPALIDAD DISTRITAL DE HUAY - HUAY;YAULI;JUNIN;120803;9.730092119;1177694.52;80.38292715;;0.592954028;1004.91715;;1;59.1799641;1720.5;;2106626.19
2016;04-301111;MARCAPOMACOCHA;  MUNICIPALIDAD DISTRITAL DE MARCAPOMACOCHA;YAULI;JUNIN;120804;7.639716072;459656.4;79.52129517;;0.513677952;850.1955335;1;;49.97063731;1061;;774605.18
2016;10-301117;YAULI;  MUNICIPALIDAD DISTRITAL DE YAULI;YAULI;JUNIN;120810;10.53020176;1965620.04;76.80668246;;0.664202882;1313.527122;1;1;69.74828827;5276;;4144035.28
2016;01-301171;SAN PEDRO DE LLOC;  MUNICIPALIDAD PROVINCIAL DE PACASMAYO - SAN PEDRO DE LLOC;PACASMAYO;LA LIBERTAD;130701;9.026722378;974082.05;81.10181894;;0.587575737;975.9204684;1;;64.02028815;17078;;1134016.29
2016;09-301184;PATAZ;  MUNICIPALIDAD DISTRITAL DE PATAZ;PATAZ;LA LIBERTAD;130809;6.570125375;3668252.99;70.70150593;;0.436069032;829.4764011;;1;34.99999228;8870.5;;5784807.87
2016;02-301206;LUCMA;  MUNICIPALIDAD DISTRITAL DE LUCMA;GRAN CHIMU;LA LIBERTAD;131102;4.497155147;610739.23;71.07947042;;0.283335783;354.3602288;1;;29.87775601;5810.5;;710922.86
2016;03-301211;GUADALUPITO;  MUNICIPALIDAD DISTRITAL DE GUADALUPITO;VIRU;LA LIBERTAD;131203;5.858439835;599074.84;76.54254574;;0.463388745;800.1036785;1;;49.92573864;8331.5;;696775.58
2016;04-301235;MANUEL ANTONIO MESONES MURO;  MUNICIPALIDAD DISTRITAL DE MANUEL ANTONIO MESONES MURO;FERREÑAFE;LAMBAYEQUE;140204;6.414476374;387.96;67.86707654;;0.428229246;658.9604408;1;;59.06076416;4019;;387.96
2016;06-301255;CARABAYLLO;  MUNICIPALIDAD DISTRITAL DE CARABAYLLO;LIMA;LIMA;150106;9.602445837;199783.46;79.51516327;;0.63980343;1153.32267;1;;74.10917693;317511.5;;349260.73
2016;18-301267;LURIGANCHO;  MUNICIPALIDAD DISTRITAL DE LURIGANCHO (CHOSICA);LIMA;LIMA;150118;9.839341836;91395.23;80.23384438;;0.664042129;1241.539275;;;75.13819778;229895;1;220512.53
2016;19-301268;LURIN;  MUNICIPALIDAD DISTRITAL DE LURIN;LIMA;LIMA;150119;9.679185364;51850.87;79.59549442;;0.668983389;1331.311963;1;;71.13414956;87163.5;;148649.33
2016;23-301272;PACHACAMAC;  MUNICIPALIDAD DISTRITAL DE PACHACAMAC;LIMA;LIMA;150123;9.104833619;58342.46;78.09090903;;0.624248955;1171.075783;1;;69.95762647;119862;;153680.95
2016;43-301292;VILLA MARIA DEL TRIUNFO;  MUNICIPALIDAD DISTRITAL DE VILLA MARIA DEL TRIUNFO;LIMA;LIMA;150143;9.597988623;71066.55;81.02515062;;0.670335204;1286.296591;1;;74.17957838;423489;;616957.18
2016;02-301312;ASIA;  MUNICIPALIDAD DISTRITAL DE ASIA;CAÑETE;LIMA;150502;8.825315736;628749.58;79.59635047;;0.637401473;1228.358902;1;;70.71584403;9552.5;;831527.15
2016;05-301315;CHILCA;  MUNICIPALIDAD DISTRITAL DE CHILCA;CAÑETE;LIMA;150505;9.488920804;859212.4;80.86227622;;0.655269574;1266.117062;1;;68.28201468;18687;;1108321.76
2016;06-301316;COAYLLO;  MUNICIPALIDAD DISTRITAL DE COAYLLO;CAÑETE;LIMA;150506;7.523637246;334461.66;87.15969261;;0.642552701;1171.246799;;1;79.35893448;1060;;617775.31
2016;01-301327;HUARAL;  MUNICIPALIDAD PROVINCIAL DE HUARAL;HUARAL;LIMA;150601;8.792027929;2916392.92;81.35845481;;0.628577507;1156.68606;;1;69.63068167;100175.5;;4489428.9
2016;10-301336;SANTA CRUZ DE ANDAMARCA;  MUNICIPALIDAD DISTRITAL DE SANTA CRUZ DE ANDAMARCA;HUARAL;LIMA;150610;9.609870178;115614.73;80.07414941;;0.544458594;760.404096;;1;66.7343638;1118.5;;685736.42
2016;05-301343;CHICLA;  MUNICIPALIDAD DISTRITAL DE CHICLA;HUAROCHIRI;LIMA;150705;9.710011173;432616.86;71.25765736;;0.686102167;1716.912227;;1;68.01436033;5729;;2103135.54
2016;16-301354;SAN ANTONIO;  MUNICIPALIDAD DISTRITAL DE SAN ANTONIO;HUAROCHIRI;LIMA;150716;7.101398009;281722.47;70.73437368;;0.407785474;585.2836063;1;;48.07054331;3190.5;;608684.21
2016;22-301360;SAN MATEO;  MUNICIPALIDAD DISTRITAL DE SAN MATEO;HUAROCHIRI;LIMA;150722;8.684487385;92391.02;70.05561955;;0.564867674;1106.743542;;1;63.63786225;4631;;196073.83
2016;01-301371;HUACHO;  MUNICIPALIDAD PROVINCIAL DE HUAURA;HUAURA;LIMA;150801;11.34284676;538286.38;78.88797089;;0.692948888;1301.73521;1;;78.27139293;60837;;1040961.59
2016;01-301383;OYON;  MUNICIPALIDAD PROVINCIAL DE OYON;OYON;LIMA;150901;8.927135068;283183.61;84.2881375;;0.614489689;1133.872067;1;1;56.11204077;13314.5;;2604155.32
2016;18-301406;LARAOS;  MUNICIPALIDAD DISTRITAL DE LARAOS;YAUYOS;LIMA;151018;8.532096388;349113.43;79.89824722;;0.582976166;1032.96958;;1;61.01388501;654;;662204.8
2016;08-301494;PUQUINA;  MUNICIPALIDAD DISTRITAL DE PUQUINA;GENERAL SANCHEZ CERRO;MOQUEGUA;180208;7.220101391;2105091.61;81.20560169;;0.498236265;665.3590312;1;;69.8961281;2448.5;;2471223.33
2016;03-301500;PACOCHA;  MUNICIPALIDAD DISTRITAL DE PACOCHA;ILO;MOQUEGUA;180303;12.78551577;302743.7;80.25370053;1;0.72092621;1326.623156;;;78.74302487;3975.5;1;355437.09
2016;04-301504;HUAYLLAY;  MUNICIPALIDAD DISTRITAL DE HUAYLLAY;PASCO;PASCO;190104;10.14321654;1162863.14;68.66388568;;0.563943827;934.6841578;;1;77.73286391;10494.5;;3071204.19
2016;08-301508;SAN FRANCISCO DE ASIS DE YARUSYACAN;  MUNICIPALIDAD DISTRITAL DE SAN FRANCISCO DE ASIS DE YARUSYACAN;PASCO;PASCO;190108;8.731407476;1125122.81;73.18842618;;0.543347544;836.5615026;;1;79.00529895;7180;;3098914.51
2016;13-301513;YANACANCHA;  MUNICIPALIDAD DISTRITAL DE YANACANCHA;PASCO;PASCO;190113;11.1988796;637580.15;77.50581614;;0.587166961;817.7541222;;1;80.33382689;29881;;1626608.6
2016;01-301566;PAITA;  MUNICIPALIDAD PROVINCIAL DE PAITA;PAITA;PIURA;200501;8.220582793;574818.21;78.03206214;;0.513704514;748.6507741;1;;62.39445754;90563;;19030145.14
2016;02-301567;AMOTAPE;  MUNICIPALIDAD DISTRITAL DE AMOTAPE;PAITA;PIURA;200502;6.524261333;24094.07;79.70728567;;0.476411675;683.807759;1;;61.17165138;2361.5;;560550.65
2016;01-301587;SECHURA;  MUNICIPALIDAD PROVINCIAL DE SECHURA;SECHURA;PIURA;200801;7.262384724;7931062.11;68.48912931;;0.43377466;644.5386207;1;;54.00212898;43782;;16993001.2
2016;02-301664;ANTAUTA;  MUNICIPALIDAD DISTRITAL DE ANTAUTA;MELGAR;PUNO;210802;7.827879299;1767801.08;70.32030592;;0.505655641;844.1309921;;1;64.38268736;4937.5;;3489192.67
2016;04-301684;CARACOTO;  MUNICIPALIDAD DISTRITAL DE CARACOTO;SAN ROMAN;PUNO;211104;5.255993522;217706.7;73.44005157;;0.349749776;382.254312;1;;59.29122349;6236.5;;260094.51
2016;06-301690;QUIACA;  MUNICIPALIDAD DISTRITAL DE QUIACA;SANDIA;PUNO;211206;6.255881607;1033934.44;68.07297718;;0.397830719;519.3343998;;1;67.46570162;2252.5;;1311889.47
2016;01-301701;MOYOBAMBA;  MUNICIPALIDAD PROVINCIAL DE MOYOBAMBA;MOYOBAMBA;SAN MARTIN;220101;7.620765575;32107.12;73.17370068;;0.4972357;832.0165931;1;;55.18343298;79900;;41003.75
2016;04-301753;NUEVA CAJAMARCA;  MUNICIPALIDAD DISTRITAL DE NUEVA CAJAMARCA;RIOJA;SAN MARTIN;220804;6.072127863;112020.12;75.12604191;;0.452917953;750.2773298;1;;49.5513656;44358.5;;138993.88
2016;02-301760;ALBERTO LEVEAU;  MUNICIPALIDAD DISTRITAL DE ALBERTO LEVEAU;SAN MARTIN;SAN MARTIN;220902;6.480777399;373.14;72.42166787;;0.418692402;612.8598395;1;;48.20262397;757;;480.35
2016;05-301808;SAN JACINTO;  MUNICIPALIDAD DISTRITAL DE SAN JACINTO;TUMBES;TUMBES;240105;7.934530773;;79.93215334;;0.543209301;800.6144181;1;;74.08357877;8526.5;;1332987.92
2017;01-300078;BAGUA GRANDE;  MUNICIPALIDAD PROVINCIAL DE UTCUBAMBA - BAGUA GRANDE;UTCUBAMBA;AMAZONAS;010701;6.6234;;73.56246455;;0.484904356;792.4766734;1;;61.86826843;50841;;2.61
2017;01-300097;AIJA;  MUNICIPALIDAD PROVINCIAL DE AIJA;AIJA;ANCASH;020201;8.5965;438344.52;57.43771638;;0.448892145;799.5284317;;1;60.8;2017;;619057.38
2017;08-300117;HUALLANCA;  MUNICIPALIDAD DISTRITAL DE HUALLANCA;BOLOGNESI;ANCASH;020508;6.9958;2666194.24;65.7510011;;0.430444726;768.858526;;1;42.51824818;6468;;4237797.69
2017;07-300131;PARIAHUANCA;  MUNICIPALIDAD DISTRITAL DE PARIAHUANCA;CARHUAZ;ANCASH;020607;5.3004;339776.44;86.71936452;;0.412531206;446.9817923;1;;67.64705882;1381;;508597.72
2017;07-300156;HUACHIS;  MUNICIPALIDAD DISTRITAL DE HUACHIS;HUARI;ANCASH;021007;5.2398;8356582.13;79.06042818;;0.351926769;422.3163584;;1;39.13043478;3307;;12340640.61
2017;19-300349;SAN JUAN DE TARUCANI;  MUNICIPALIDAD DISTRITAL DE SAN JUAN DE TARUCANI;AREQUIPA;AREQUIPA;040119;5.4172;764426.34;85.07486475;;0.49843678;748.444576;1;;71.68141593;1377;;1616554.17
2017;24-300354;UCHUMAYO;  MUNICIPALIDAD DISTRITAL DE UCHUMAYO;AREQUIPA;AREQUIPA;040124;10.0078;9881410.48;82.2922273;;0.650057005;1087.176267;1;;78.58472998;14054;;17406964.27
2017;28-300358;YURA;  MUNICIPALIDAD DISTRITAL DE YURA;AREQUIPA;AREQUIPA;040128;8.3598;10583956.3;78.50618267;;0.592889059;992.0741519;1;;78.42880524;33346;;19958782.39
2017;07-300366;QUILCA;  MUNICIPALIDAD DISTRITAL DE QUILCA;CAMANA;AREQUIPA;040207;8.1369;118255.52;88.13784717;;0.529403867;672.2225087;1;;66.66666667;943;;235081.02
2017;08-300375;CHAPARRA;  MUNICIPALIDAD DISTRITAL DE CHAPARRA;CARAVELI;AREQUIPA;040308;8.6432;1497840.7;90.064787;;0.67747246;1325.134251;;1;62.28070175;3685;;2536164.81
2017;09-300376;HUANUHUANU;  MUNICIPALIDAD DISTRITAL DE HUANUHUANU;CARAVELI;AREQUIPA;040309;8.321;1111376.15;93.57922904;;0.720897625;1551.59519;;1;61.80555556;3047;;1940004.9
2017;09-300389;ORCOPAMPA;  MUNICIPALIDAD DISTRITAL DE ORCOPAMPA;CASTILLA;AREQUIPA;040409;8.4402;1002983.53;79.17366674;;0.559402494;1075.819613;;1;45.08816121;8177;;2482923.29
2017;04-300398;CALLALLI;  MUNICIPALIDAD DISTRITAL DE CALLALLI;CAYLLOMA;AREQUIPA;040504;5.1712;418041.67;85.83841711;;0.49999908;897.6054879;1;;52.27272727;1458;;788869.53
2017;16-300410;TAPAY;  MUNICIPALIDAD DISTRITAL DE TAPAY;CAYLLOMA;AREQUIPA;040516;7.6519;110612.19;82.07723574;;0.617236456;1377.365157;;1;50;772;;255240.66
2017;03-300417;CAYARANI;  MUNICIPALIDAD DISTRITAL DE CAYARANI;CONDESUYOS;AREQUIPA;040603;7.1918;702837.32;93.38973811;;0.625506516;1400.58733;;1;39.56043956;3212;;2138843.79
2017;06-300420;RIO GRANDE;  MUNICIPALIDAD DISTRITAL DE RIO GRANDE;CONDESUYOS;AREQUIPA;040606;8.4502;415721.88;74.71260203;;0.637327528;1389.97669;;1;68.98734177;3263;;822896.21
2017;06-300513;OYOLO;  MUNICIPALIDAD DISTRITAL DE OYOLO;PAUCAR DEL SARA SARA;AYACUCHO;050806;8.4366;10947.91;57.73810905;;0.421969704;785.0538569;;1;43.82022472;1453;;787142.43
2017;05-300533;CANARIA;  MUNICIPALIDAD DISTRITAL DE CANARIA;VICTOR FAJARDO;AYACUCHO;051005;7.2955;286390.86;73.46383426;;0.490939926;763.0922342;;1;63.55932203;3977;;1100206.98
2017;08-300604;YONAN;  MUNICIPALIDAD DISTRITAL DE YONAN;CONTUMAZA;CAJAMARCA;060508;7.3694;419177.72;72.34390284;;0.48719474;762.0065296;1;;62.95454546;6726;;553733.15
2017;09-300674;SEXI;  MUNICIPALIDAD DISTRITAL DE SEXI;SANTA CRUZ;CAJAMARCA;061309;6.8099;195769.72;76.64306255;;0.537756402;844.8712688;1;;85.71428571;425;;233325.34
2017;07-300746;SUYCKUTAMBO;  MUNICIPALIDAD DISTRITAL DE SUYCKUTAMBO;ESPINAR;CUSCO;080807;3.0449;991715.61;73.17910204;;0.298425753;369.908096;;1;67.69230769;1643;;3691336.59
2017;06-300797;HUACHOCOLPA;  MUNICIPALIDAD DISTRITAL DE HUACHOCOLPA;HUANCAVELICA;HUANCAVELICA;090106;5.7978;13812.16;64.83272178;;0.417216439;764.2150584;;1;48.57142857;1875;;316395.86
2017;04-300820;CCOCHACCASA;  MUNICIPALIDAD DISTRITAL DE CCOCHACCASA;ANGARAES;HUANCAVELICA;090304;5.558;97413.79;63.91831619;;0.356485108;474.5044541;;1;57.98045603;2956;;472229.76
2017;09-300850;SAN PEDRO DE CORIS;  MUNICIPALIDAD DISTRITAL DE SAN PEDRO DE CORIS;CHURCAMPA;HUANCAVELICA;090509;6.4664;3804.53;57.38020902;;0.413275314;748.6867408;;1;62.10191083;3445;;368847.88
2017;03-300887;CHINCHAO;  MUNICIPALIDAD DISTRITAL DE CHINCHAO;HUANUCO;HUANUCO;100103;3.4689;27573.84;79.13674457;;0.292186191;339.2840424;1;;42.67857143;13135;;62605.59
2017;07-300952;SAN MIGUEL DE CAURI;  MUNICIPALIDAD DISTRITAL DE SAN MIGUEL DE CAURI;LAURICOCHA;HUANUCO;101007;7.753;608416.87;67.14414534;;0.478949798;883.7090377;;1;49.23076923;5853;;1808199.67
2017;03-300976;CHAVIN;  MUNICIPALIDAD DISTRITAL DE CHAVIN;CHINCHA;ICA;110203;10.7964;6123097.06;80.28850133;;0.625443319;1197.845512;;1;50;2071;;6153080.13
2017;05-300989;VISTA ALEGRE;  MUNICIPALIDAD DISTRITAL DE VISTA ALEGRE;NASCA;ICA;110305;9.1029;2846451.54;86.34470954;;0.609710008;935.7827055;;1;71.56076496;20460;;4109359.74
2017;05-300999;PARACAS;  MUNICIPALIDAD DISTRITAL DE PARACAS;PISCO;ICA;110505;9.5509;572792.15;75.95081099;;0.627766137;1217.447343;1;;67.57624398;7147;1;746015.54
2017;07-301001;SAN CLEMENTE;  MUNICIPALIDAD DISTRITAL DE SAN CLEMENTE;PISCO;ICA;110507;8.6543;1468333.59;75.94440158;;0.564877109;920.7990758;1;;72.2972973;24814;;1817579.88
2017;12-301010;COLCA;  MUNICIPALIDAD DISTRITAL DE COLCA;HUANCAYO;JUNIN;120112;5.4407;58018.07;70.6590919;;0.4688982;967.7028962;1;;50;1017;;87236.95
2017;06-301051;VITOC;  MUNICIPALIDAD DISTRITAL DE VITOC;CHANCHAMAYO;JUNIN;120306;6.8513;37723.78;71.97003943;;0.495316942;881.8692089;;1;57.39130435;1814;;737730.27
2017;06-301057;CURICACA;  MUNICIPALIDAD DISTRITAL DE CURICACA;JAUJA;JUNIN;120406;6.7058;58477.4;65.3707518;;0.431059123;708.4381016;1;;54.95495496;1410;;81248.03
2017;05-301102;LA UNION;  MUNICIPALIDAD DISTRITAL DE LA UNION;TARMA;JUNIN;120705;7.5217;220777.34;78.68423431;;0.508804463;689.152514;1;;76.37540453;3514;;451060.51
2017;01-301108;LA OROYA;  MUNICIPALIDAD PROVINCIAL DE YAULI - LA OROYA;YAULI;JUNIN;120801;9.7045;3310323.56;75.86239946;1;0.558704172;840.7196582;;;71.16724739;14021;;4418781.21
2017;03-301110;HUAY-HUAY;  MUNICIPALIDAD DISTRITAL DE HUAY - HUAY;YAULI;JUNIN;120803;9.6569;2249812.22;80.98159239;;0.612287722;1051.835969;;1;64.28571429;1947;;3254612.35
2017;04-301111;MARCAPOMACOCHA;  MUNICIPALIDAD DISTRITAL DE MARCAPOMACOCHA;YAULI;JUNIN;120804;7.4702;1140859.98;79.91905953;;0.529576099;940.253287;1;;48.88888889;835;;1495900.85
2017;10-301117;YAULI;  MUNICIPALIDAD DISTRITAL DE YAULI;YAULI;JUNIN;120810;10.5473;4534985.96;77.1069066;;0.675414473;1376.389719;1;1;69.00369004;5341;;6667928.88
2018;01-301108;LA OROYA;  MUNICIPALIDAD PROVINCIAL DE YAULI - LA OROYA;YAULI;JUNIN;120801;9.675496551;6798769.68;76.15952555;1;0.570346057;890.2807855;;;70.90991448;14117.78506;;8174905.4
2019;01-301108;LA OROYA;  MUNICIPALIDAD PROVINCIAL DE YAULI - LA OROYA;YAULI;JUNIN;120801;10.04967162;5333025.18;75.51508523;1;0.621171122;1128.403546;;;70.90101252;8996.897216;;6383411.94
2020;01-301108;LA OROYA;  MUNICIPALIDAD PROVINCIAL DE YAULI - LA OROYA;YAULI;JUNIN;120801;10.04967162;2001583.98;75.51508523;1;0.621171122;1128.403546;;;70.90101252;8996.897216;;2813459.82
2017;06-301255;CARABAYLLO;  MUNICIPALIDAD DISTRITAL DE CARABAYLLO;LIMA;LIMA;150106;9.4495;199304.34;79.77456893;;0.662879143;1277.25578;1;;74.40768335;333045;;346494.14
2017;19-301268;LURIN;  MUNICIPALIDAD DISTRITAL DE LURIN;LIMA;LIMA;150119;9.5231;106091.83;79.70375163;;0.691154232;1468.892071;1;;71.25506073;89195;;204530.2
2017;23-301272;PACHACAMAC;  MUNICIPALIDAD DISTRITAL DE PACHACAMAC;LIMA;LIMA;150123;8.7898;139604.64;77.99290926;;0.645634317;1304.010578;1;;71.17272083;110071;;232943.85
2017;43-301292;VILLA MARIA DEL TRIUNFO;  MUNICIPALIDAD DISTRITAL DE VILLA MARIA DEL TRIUNFO;LIMA;LIMA;150143;9.3769;507524.53;81.48789303;;0.693240346;1421.425324;1;;74.18778476;398433;;1041501.92
2017;01-301701;MOYOBAMBA;  MUNICIPALIDAD PROVINCIAL DE MOYOBAMBA;MOYOBAMBA;SAN MARTIN;220101;7.4865;36255.05;72.91353705;;0.515820329;917.6946728;1;;57.5218571;76325;;45253.55
2017;05-301808;SAN JACINTO;  MUNICIPALIDAD DISTRITAL DE SAN JACINTO;TUMBES;TUMBES;240105;7.8365;1998.66;79.30259295;;0.550154311;862.0508719;1;;70.73608618;8512;;1293394.5
2018;19-300349;SAN JUAN DE TARUCANI;  MUNICIPALIDAD DISTRITAL DE SAN JUAN DE TARUCANI;AREQUIPA;AREQUIPA;040119;5.464998786;1543503.83;86.55436645;;0.515799584;788.8130047;1;;74.12962438;1386.505244;;2498119.11
2018;24-300354;UCHUMAYO;  MUNICIPALIDAD DISTRITAL DE UCHUMAYO;AREQUIPA;AREQUIPA;040124;10.00680169;21342440.01;83.24146859;;0.668856096;1162.609637;1;;78.57143753;14151.01285;;30317233.58
2018;28-300358;YURA;  MUNICIPALIDAD DISTRITAL DE YURA;AREQUIPA;AREQUIPA;040128;8.424288595;22940510.74;79.11303291;;0.611876579;1072.33885;1;;78.09502877;33576.1829;;34908559.7
2018;03-300887;CHINCHAO;  MUNICIPALIDAD DISTRITAL DE CHINCHAO;HUANUCO;HUANUCO;100103;3.515373844;94570.75;80.16395533;;0.306956034;364.1674356;1;;45.93867179;13225.66912;;155503.61
