2011;04-301504;HUAYLLAY;  MUNICIPALIDAD DISTRITAL DE HUAYLLAY;PASCO;PASCO;190104;9.910369772;14379098.06;70.60681504;;0.538931802;860.9618741;;1;66.1313547;11179;;23638726.35
2011;08-301508;SAN FRANCISCO DE ASIS DE YARUSYACAN;  MUNICIPALIDAD DISTRITAL DE SAN FRANCISCO DE ASIS DE YARUSYACAN;PASCO;PASCO;190108;8.703066058;10966066.39;72.58950536;;0.413062833;407.4168377;;1;71.15384615;10742;;14892308.54
2011;13-301513;YANACANCHA;  MUNICIPALIDAD DISTRITAL DE YANACANCHA;PASCO;PASCO;190113;11.28394382;9781324.55;74.59819938;;0.536842209;653.8869135;;1;83.20726173;30545;;13423557.65
2011;01-301566;PAITA;  MUNICIPALIDAD PROVINCIAL DE PAITA;PAITA;PIURA;200501;8.88082186;2598.77;74.94870646;;0.515189835;771.3744368;1;;60.63157359;83348;;23899352.57
2011;02-301567;AMOTAPE;  MUNICIPALIDAD DISTRITAL DE AMOTAPE;PAITA;PIURA;200502;6.778975197;279.38;75.44239167;;0.422631864;526.3769565;1;;57.86783546;2348;;1008635.27
2011;01-301587;SECHURA;  MUNICIPALIDAD PROVINCIAL DE SECHURA;SECHURA;PIURA;200801;7.401966253;30614.45;68.98804815;;0.412284927;583.7622969;1;;46.73379346;38131;;14626970.15
2011;02-301664;ANTAUTA;  MUNICIPALIDAD DISTRITAL DE ANTAUTA;MELGAR;PUNO;210802;7.383132079;8276822.79;68.19632979;;0.395063674;515.6814264;;1;49.06151998;4871;;15870353.35
2011;04-301684;CARACOTO;  MUNICIPALIDAD DISTRITAL DE CARACOTO;SAN ROMAN;PUNO;211104;5.003199117;754343.91;71.49449859;;0.253210588;195.3648688;1;;45.97379145;5993;;944484.9
2011;06-301690;QUIACA;  MUNICIPALIDAD DISTRITAL DE QUIACA;SANDIA;PUNO;211206;6.219677136;506040.02;67.83501548;;0.206027778;125.1088574;;1;36.07912561;2352;;580899.12
2011;01-301701;MOYOBAMBA;  MUNICIPALIDAD PROVINCIAL DE MOYOBAMBA;MOYOBAMBA;SAN MARTIN;220101;7.911268896;19689.3;73.61756094;;0.414798601;510.6105449;1;;48.42032641;74753;;22020.45
2011;04-301753;NUEVA CAJAMARCA;  MUNICIPALIDAD DISTRITAL DE NUEVA CAJAMARCA;RIOJA;SAN MARTIN;220804;6.622354257;68519.27;75.22891205;;0.370077344;424.2979461;1;;43.27616877;40867;;71828.27
2011;02-301760;ALBERTO LEVEAU;  MUNICIPALIDAD DISTRITAL DE ALBERTO LEVEAU;SAN MARTIN;SAN MARTIN;220902;6.592920683;2050;72.76156678;;0.341389487;358.4129371;1;;42.99850911;766;;3203.12
2011;05-301808;SAN JACINTO;  MUNICIPALIDAD DISTRITAL DE SAN JACINTO;TUMBES;TUMBES;240105;8.04686047;;79.25590065;;0.492945576;574.2895545;1;;83.33333333;8533;;2460254.32
2012;01-300078;BAGUA GRANDE;  MUNICIPALIDAD PROVINCIAL DE UTCUBAMBA - BAGUA GRANDE;UTCUBAMBA;AMAZONAS;010701;6.964914347;3.59;74.27567673;;0.406029984;571.5103839;1;;38.55571378;52821;;5.21
2012;01-300097;AIJA;  MUNICIPALIDAD PROVINCIAL DE AIJA;AIJA;ANCASH;020201;8.746758035;990006.83;62.17986809;;0.33090901;320.6782795;;1;52.0384011;1962;;991921.09
2012;08-300117;HUALLANCA;  MUNICIPALIDAD DISTRITAL DE HUALLANCA;BOLOGNESI;ANCASH;020508;7.186536364;4962860.6;68.16579213;;0.364342591;482.5045939;;1;36.14933576;8391;;5249219.25
2012;07-300131;PARIAHUANCA;  MUNICIPALIDAD DISTRITAL DE PARIAHUANCA;CARHUAZ;ANCASH;020607;5.849251454;692658.74;79.68831169;;0.341007648;365.3954341;1;;36.94686173;1589;;695489.03
2012;07-300156;HUACHIS;  MUNICIPALIDAD DISTRITAL DE HUACHIS;HUARI;ANCASH;021007;4.768963533;17398000.67;75.28650113;;0.194913697;108.4524714;;1;42.04925623;3655;;17420223.79
2012;19-300349;SAN JUAN DE TARUCANI;  MUNICIPALIDAD DISTRITAL DE SAN JUAN DE TARUCANI;AREQUIPA;AREQUIPA;040119;6.132788372;2456694.59;79.97009638;;0.336585402;312.2744686;1;;44.87000428;2202;;2683502.69
2012;24-300354;UCHUMAYO;  MUNICIPALIDAD DISTRITAL DE UCHUMAYO;AREQUIPA;AREQUIPA;040124;10.72948344;29324463.05;78.32835111;;0.593346315;857.0182221;1;;78.98937079;11861;;29506191.51
2012;28-300358;YURA;  MUNICIPALIDAD DISTRITAL DE YURA;AREQUIPA;AREQUIPA;040128;8.871634763;25870332.52;76.46998655;;0.505372345;610.2157019;1;;83.48416988;21474;;27837097.8
2012;07-300366;QUILCA;  MUNICIPALIDAD DISTRITAL DE QUILCA;CAMANA;AREQUIPA;040207;8.466775226;447690.07;81.88939375;;0.522573499;669.6709384;1;;72.78356645;724;;468603.83
2012;08-300375;CHAPARRA;  MUNICIPALIDAD DISTRITAL DE CHAPARRA;CARAVELI;AREQUIPA;040308;9.645528168;2840182.1;83.13208185;;0.526760896;721.2129309;;1;53.1537766;4797;;3074981.19
2012;09-300376;HUANUHUANU;  MUNICIPALIDAD DISTRITAL DE HUANUHUANU;CARAVELI;AREQUIPA;040309;8.573650214;2145806.23;83.85247615;;0.457765154;477.9760406;;1;62.08237907;2992;;2327063.06
2012;09-300389;ORCOPAMPA;  MUNICIPALIDAD DISTRITAL DE ORCOPAMPA;CASTILLA;AREQUIPA;040409;9.443762608;6670237.27;75.59691267;;0.523686401;874.2569317;;1;46.48441482;9234;;8215775.25
2012;04-300398;CALLALLI;  MUNICIPALIDAD DISTRITAL DE CALLALLI;CAYLLOMA;AREQUIPA;040504;6.563208854;1543532.85;79.22133504;;0.378318361;351.6800267;1;;64.84669172;2210;;1626940.65
2012;16-300410;TAPAY;  MUNICIPALIDAD DISTRITAL DE TAPAY;CAYLLOMA;AREQUIPA;040516;4.576353613;404176.09;76.99154564;;0.245261162;129.9136277;;1;100;597;;426001.73
2012;03-300417;CAYARANI;  MUNICIPALIDAD DISTRITAL DE CAYARANI;CONDESUYOS;AREQUIPA;040603;7.685640425;3568002.82;83.15220359;;0.400527063;482.0345858;;1;32.2409299;3398;;6016789.7
2012;06-300420;RIO GRANDE;  MUNICIPALIDAD DISTRITAL DE RIO GRANDE;CONDESUYOS;AREQUIPA;040606;9.195176463;1968991.93;74.14189951;;0.562691206;859.514847;;1;81.20748846;3038;;2328330.9
2012;06-300513;OYOLO;  MUNICIPALIDAD DISTRITAL DE OYOLO;PAUCAR DEL SARA SARA;AYACUCHO;050806;7.233254087;86640.05;64.40123716;;0.161219997;142.272613;;1;5.619280288;1186;;99035.19
2012;05-300533;CANARIA;  MUNICIPALIDAD DISTRITAL DE CANARIA;VICTOR FAJARDO;AYACUCHO;051005;6.407666975;211734.93;72.32581735;;0.339085181;421.1732117;;1;30.67862824;4025;;537743.57
2012;08-300604;YONAN;  MUNICIPALIDAD DISTRITAL DE YONAN;CONTUMAZA;CAJAMARCA;060508;7.889591513;1453228.45;72.66177253;;0.509827846;890.5346485;1;;53.87189582;8065;;1604862.88
2012;09-300674;SEXI;  MUNICIPALIDAD DISTRITAL DE SEXI;SANTA CRUZ;CAJAMARCA;061309;6.905804734;488378.03;74.72894125;;0.36890533;339.9730424;1;;66.66666667;562;;518616.83
2012;07-300746;SUYCKUTAMBO;  MUNICIPALIDAD DISTRITAL DE SUYCKUTAMBO;ESPINAR;CUSCO;080807;4.391490638;4490770.46;70.9285154;;0.266033951;272.2093153;;1;35.79885515;2856;;7727776.15
2012;06-300797;HUACHOCOLPA;  MUNICIPALIDAD DISTRITAL DE HUACHOCOLPA;HUANCAVELICA;HUANCAVELICA;090106;7.218074727;329915.68;64.73243841;;0.382759499;706.3582551;;1;25.33590731;2975;;504598.41
2012;04-300820;CCOCHACCASA;  MUNICIPALIDAD DISTRITAL DE CCOCHACCASA;ANGARAES;HUANCAVELICA;090304;5.661011146;975796.3;64.98328271;;0.308021426;396.6933574;;1;32.85271265;3054;;1343610.8
2012;09-300850;SAN PEDRO DE CORIS;  MUNICIPALIDAD DISTRITAL DE SAN PEDRO DE CORIS;CHURCAMPA;HUANCAVELICA;090509;7.459909461;75250.93;62.57975955;;0.405520407;717.4917174;;1;37.10126618;3358;;601205.3
2012;03-300887;CHINCHAO;  MUNICIPALIDAD DISTRITAL DE CHINCHAO;HUANUCO;HUANUCO;100103;3.641717499;58149.31;75.97886746;;0.230191507;286.0216535;1;;15.32267944;26290;;77532.45
2012;07-300952;SAN MIGUEL DE CAURI;  MUNICIPALIDAD DISTRITAL DE SAN MIGUEL DE CAURI;LAURICOCHA;HUANUCO;101007;7.055805967;715657.33;69.25712694;;0.324565151;361.1666581;;1;33.15515995;10335;;1076092.23
2012;03-300976;CHAVIN;  MUNICIPALIDAD DISTRITAL DE CHAVIN;CHINCHA;ICA;110203;8.257768296;5391226.15;78.15683074;;0.434597807;583.2483264;;1;38.15879292;1298;;5459163.84
2012;05-300989;VISTA ALEGRE;  MUNICIPALIDAD DISTRITAL DE VISTA ALEGRE;NASCA;ICA;110305;9.47125426;20538342.01;82.34266271;;0.504071989;554.4481931;;1;74.864083;14894;;23470522.64
2012;05-300999;PARACAS;  MUNICIPALIDAD DISTRITAL DE PARACAS;PISCO;ICA;110505;10.22203214;1754056.41;76.42520118;;0.500188201;677.0412268;1;;52.98227747;5722;1;2017388.73
2012;07-301001;SAN CLEMENTE;  MUNICIPALIDAD DISTRITAL DE SAN CLEMENTE;PISCO;ICA;110507;9.250341988;5497534.56;75.9422707;;0.472388378;580.6818736;1;;59.95260485;21027;;6321590.96
2012;12-301010;COLCA;  MUNICIPALIDAD DISTRITAL DE COLCA;HUANCAYO;JUNIN;120112;7.757057067;117428.51;71.4149875;;0.318382296;225.1857669;1;;69.6969697;2080;;140248.35
2012;06-301051;VITOC;  MUNICIPALIDAD DISTRITAL DE VITOC;CHANCHAMAYO;JUNIN;120306;8.044605355;88440.71;72.5102338;;0.503793229;873.3354448;;1;51.26531838;2218;;304332.7
2012;06-301057;CURICACA;  MUNICIPALIDAD DISTRITAL DE CURICACA;JAUJA;JUNIN;120406;7.253709372;106628.67;68.3033479;;0.400884661;484.0665735;1;;62.51509965;1720;;120365.12
2012;05-301102;LA UNION;  MUNICIPALIDAD DISTRITAL DE LA UNION;TARMA;JUNIN;120705;7.621855186;667078.04;75.57356053;;0.430341012;491.5464669;1;;63.56567783;3517;;738624.89
2012;01-301108;LA OROYA;  MUNICIPALIDAD PROVINCIAL DE YAULI - LA OROYA;YAULI;JUNIN;120801;10.45830476;6180235.88;74.80108187;1;0.603884395;1001.58717;;;75.08532423;15726;;6866082.19
2012;03-301110;HUAY-HUAY;  MUNICIPALIDAD DISTRITAL DE HUAY - HUAY;YAULI;JUNIN;120803;9.772701581;4575379.27;77.21747603;;0.520276127;831.3694659;;1;44.68498585;1594;;5511047.3
2012;04-301111;MARCAPOMACOCHA;  MUNICIPALIDAD DISTRITAL DE MARCAPOMACOCHA;YAULI;JUNIN;120804;8.025987405;1555189.97;76.84674111;;0.450260511;574.9459944;1;;53.04641534;1307;;1724050.39
2012;10-301117;YAULI;  MUNICIPALIDAD DISTRITAL DE YAULI;YAULI;JUNIN;120810;10.43055748;6293032.08;75.349743;;0.616139495;1074.864841;1;1;71.83098592;5600;;7706162.03
2012;01-301171;SAN PEDRO DE LLOC;  MUNICIPALIDAD PROVINCIAL DE PACASMAYO - SAN PEDRO DE LLOC;PACASMAYO;LA LIBERTAD;130701;9.845379085;2227307.7;78.78641666;;0.521568113;679.6930481;1;;64.63878327;16680;;2428209.62
2012;09-301184;PATAZ;  MUNICIPALIDAD DISTRITAL DE PATAZ;PATAZ;LA LIBERTAD;130809;7.278262995;5602098.16;70.84272215;;0.319044506;380.4997792;;1;23.83708203;8400;;6907927.96
2012;02-301206;LUCMA;  MUNICIPALIDAD DISTRITAL DE LUCMA;GRAN CHIMU;LA LIBERTAD;131102;5.524182908;1306376.59;72.08799923;;0.173706613;113.0567748;1;;16.96094791;6564;;1423674.86
2012;03-301211;GUADALUPITO;  MUNICIPALIDAD DISTRITAL DE GUADALUPITO;VIRU;LA LIBERTAD;131203;6.194677823;1147556.04;75.62241838;;0.356325882;393.7008365;1;;43.87643246;8260;;1249612.73
2012;04-301235;MANUEL ANTONIO MESONES MURO;  MUNICIPALIDAD DISTRITAL DE MANUEL ANTONIO MESONES MURO;FERREÑAFE;LAMBAYEQUE;140204;6.928295431;1117.08;68.55805691;;0.373808034;428.0693424;1;;56.37260496;4307;;1195.23
2012;06-301255;CARABAYLLO;  MUNICIPALIDAD DISTRITAL DE CARABAYLLO;LIMA;LIMA;150106;10.25793225;306433.36;78.22633135;;0.562473484;783.5935896;1;;73.25335814;267961;;376221.89
2012;18-301267;LURIGANCHO;  MUNICIPALIDAD DISTRITAL DE LURIGANCHO (CHOSICA);LIMA;LIMA;150118;10.74346503;389537.69;79.19090431;;0.605174794;908.546412;;;76.13407902;201248;1;486900.37
2012;19-301268;LURIN;  MUNICIPALIDAD DISTRITAL DE LURIN;LIMA;LIMA;150119;10.06723534;355307.8;78.65047251;;0.587480589;905.7144123;1;;70.78267219;76874;;422123.95
2012;23-301272;PACHACAMAC;  MUNICIPALIDAD DISTRITAL DE PACHACAMAC;LIMA;LIMA;150123;9.931932033;207755.45;77.9135925;;0.544884965;767.7512893;1;;66.49855662;102691;;263202.23
2012;43-301292;VILLA MARIA DEL TRIUNFO;  MUNICIPALIDAD DISTRITAL DE VILLA MARIA DEL TRIUNFO;LIMA;LIMA;150143;10.16275796;729536.32;78.99524328;;0.588037669;877.8453816;1;;74.14796237;426462;;978595.17
2012;02-301312;ASIA;  MUNICIPALIDAD DISTRITAL DE ASIA;CAÑETE;LIMA;150502;9.260469138;639009.53;78.92265163;;0.539269312;815.9704873;1;;57.74057022;8271;;830618.79
2012;05-301315;CHILCA;  MUNICIPALIDAD DISTRITAL DE CHILCA;CAÑETE;LIMA;150505;9.89924017;1145815.85;79.42992718;;0.567007425;900.4586593;1;;57.43078208;15517;;1405166.04
2012;06-301316;COAYLLO;  MUNICIPALIDAD DISTRITAL DE COAYLLO;CAÑETE;LIMA;150506;8.025351365;123024.17;83.1377585;;0.492030538;520.4277111;;1;88.88888889;1081;;319363
2012;01-301327;HUARAL;  MUNICIPALIDAD PROVINCIAL DE HUARAL;HUARAL;LIMA;150601;9.180250455;8806171.66;79.5616631;;0.539217178;739.3621862;;1;70.04362958;96986;;10315857.5
2012;10-301336;SANTA CRUZ DE ANDAMARCA;  MUNICIPALIDAD DISTRITAL DE SANTA CRUZ DE ANDAMARCA;HUARAL;LIMA;150610;8.365579487;197049.9;78.52237769;;0.419134679;393.646046;;1;69.60978796;1349;;227825.76
2012;05-301343;CHICLA;  MUNICIPALIDAD DISTRITAL DE CHICLA;HUAROCHIRI;LIMA;150705;10.27598593;6740680.65;72.19895683;;0.663809236;1509.199472;;1;64.76150124;7582;;7550687.4
2012;16-301354;SAN ANTONIO;  MUNICIPALIDAD DISTRITAL DE SAN ANTONIO;HUAROCHIRI;LIMA;150716;8.368142249;1933782.8;72.94309528;;0.27201255;142.67442;1;;71.88504887;5180;;2178924.64
2012;22-301360;SAN MATEO;  MUNICIPALIDAD DISTRITAL DE SAN MATEO;HUAROCHIRI;LIMA;150722;9.857671227;823320.07;71.38855467;;0.545188305;851.9046374;;1;70.49039269;5222;;963808.64
2012;01-301371;HUACHO;  MUNICIPALIDAD PROVINCIAL DE HUAURA;HUAURA;LIMA;150801;11.68835997;2249385.98;77.49896756;;0.626538536;943.2336157;1;;83.57771261;58105;;2679765.65
2012;01-301383;OYON;  MUNICIPALIDAD PROVINCIAL DE OYON;OYON;LIMA;150901;9.102189036;8831280.41;79.62912155;;0.522275836;748.4962275;1;1;56.82499696;13974;;11184903.31
2012;18-301406;LARAOS;  MUNICIPALIDAD DISTRITAL DE LARAOS;YAUYOS;LIMA;151018;9.870351095;1640331.18;76.42759279;;0.592855636;963.1722778;;1;73.34599469;855;;2475473.41
2012;08-301494;PUQUINA;  MUNICIPALIDAD DISTRITAL DE PUQUINA;GENERAL SANCHEZ CERRO;MOQUEGUA;180208;7.566642051;4292039.81;80.03633758;;0.497971727;681.6651581;1;;64.84430462;2734;;5524554.79
2012;03-301500;PACOCHA;  MUNICIPALIDAD DISTRITAL DE PACOCHA;ILO;MOQUEGUA;180303;13.32406062;630372.64;78.01606111;1;0.791993961;1595.216834;;;97.22222222;3871;1;811080.47
2012;04-301504;HUAYLLAY;  MUNICIPALIDAD DISTRITAL DE HUAYLLAY;PASCO;PASCO;190104;9.950437509;17517036.65;70.43393001;;0.5299087;820.6765023;;1;66.22194479;11247;;21152551.45
2012;08-301508;SAN FRANCISCO DE ASIS DE YARUSYACAN;  MUNICIPALIDAD DISTRITAL DE SAN FRANCISCO DE ASIS DE YARUSYACAN;PASCO;PASCO;190108;8.832391237;10868145.92;72.97856852;;0.398293511;363.1134619;;1;71.15384615;10536;;12176419.74
2012;13-301513;YANACANCHA;  MUNICIPALIDAD DISTRITAL DE YANACANCHA;PASCO;PASCO;190113;11.38037548;9787783.45;75.31051109;;0.53159489;624.4189964;;1;83.20726173;30585;;10948723.79
2012;01-301566;PAITA;  MUNICIPALIDAD PROVINCIAL DE PAITA;PAITA;PIURA;200501;8.937455947;3540.85;75.42885969;;0.533214938;840.3561694;1;;60.64022752;85757;;35396514.64
2012;02-301567;AMOTAPE;  MUNICIPALIDAD DISTRITAL DE AMOTAPE;PAITA;PIURA;200502;6.927567713;311.55;76.1338955;;0.437064192;563.2441396;1;;57.87586792;2339;;1430302
2012;01-301587;SECHURA;  MUNICIPALIDAD PROVINCIAL DE SECHURA;SECHURA;PIURA;200801;7.501621649;44133.5;68.68222865;;0.423487604;628.5751875;1;;46.7422336;39307;;21233352.76
2012;02-301664;ANTAUTA;  MUNICIPALIDAD DISTRITAL DE ANTAUTA;MELGAR;PUNO;210802;7.411443816;7726073.1;68.73677075;;0.428054148;637.1509127;;1;49.09510677;4782;;13717601.93
2012;04-301684;CARACOTO;  MUNICIPALIDAD DISTRITAL DE CARACOTO;SAN ROMAN;PUNO;211104;5.124550118;732824.03;71.92571358;;0.268554179;221.0498723;1;;45.98357938;5908;;995026.51
2012;06-301690;QUIACA;  MUNICIPALIDAD DISTRITAL DE QUIACA;SANDIA;PUNO;211206;6.2775738;512620.28;67.89710188;;0.211808207;132.1153656;;1;36.09165811;2358;;570105.1
2012;01-301701;MOYOBAMBA;  MUNICIPALIDAD PROVINCIAL DE MOYOBAMBA;MOYOBAMBA;SAN MARTIN;220101;7.886479243;30785.38;73.73942312;;0.42533634;547.0720837;1;;48.5099152;76915;;34234.96
2012;04-301753;NUEVA CAJAMARCA;  MUNICIPALIDAD DISTRITAL DE NUEVA CAJAMARCA;RIOJA;SAN MARTIN;220804;6.613205427;84847.6;75.582729;;0.380353;454.5425558;1;;43.38652009;41981;;93010.4
2012;02-301760;ALBERTO LEVEAU;  MUNICIPALIDAD DISTRITAL DE ALBERTO LEVEAU;SAN MARTIN;SAN MARTIN;220902;6.544291502;1833.45;72.98840296;;0.346688498;373.5423344;1;;43.07163529;742;;2078.8
2012;05-301808;SAN JACINTO;  MUNICIPALIDAD DISTRITAL DE SAN JACINTO;TUMBES;TUMBES;240105;8.152038766;;79.66729285;;0.504708255;604.6919136;1;;83.33333333;8542;;3499676.07
2013;01-300078;BAGUA GRANDE;  MUNICIPALIDAD PROVINCIAL DE UTCUBAMBA - BAGUA GRANDE;UTCUBAMBA;AMAZONAS;010701;6.901792581;0.76;74.28699091;;0.430287138;638.7007952;1;;44.13022552;53179;;2.74
2013;01-300097;AIJA;  MUNICIPALIDAD PROVINCIAL DE AIJA;AIJA;ANCASH;020201;8.725995161;867997.83;60.83717217;;0.365417455;439.9887346;;1;54.15350011;1917.5;;870892.39
2013;08-300117;HUALLANCA;  MUNICIPALIDAD DISTRITAL DE HUALLANCA;BOLOGNESI;ANCASH;020508;7.286578782;4161092.97;67.59957578;;0.386248496;563.2190562;;1;37.69310557;8305.5;;4557095.07
2013;07-300131;PARIAHUANCA;  MUNICIPALIDAD DISTRITAL DE PARIAHUANCA;CARHUAZ;ANCASH;020607;5.742475578;698320.87;81.95800199;;0.363146517;391.3257875;1;;44.31308814;1599;;701630.71
2013;07-300156;HUACHIS;  MUNICIPALIDAD DISTRITAL DE HUACHIS;HUARI;ANCASH;021007;4.888624259;17790502.95;76.68513701;;0.241300505;181.1474866;;1;41.36032732;3582;;17885242.03
2013;19-300349;SAN JUAN DE TARUCANI;  MUNICIPALIDAD DISTRITAL DE SAN JUAN DE TARUCANI;AREQUIPA;AREQUIPA;040119;5.967560979;1413097.07;81.62868601;;0.379927666;412.1702738;1;;51.29400507;2190.5;;1648562.32
2013;24-300354;UCHUMAYO;  MUNICIPALIDAD DISTRITAL DE UCHUMAYO;AREQUIPA;AREQUIPA;040124;10.58500338;16734322.54;79.55275407;;0.610549946;919.6626124;1;;78.89462696;12148.5;;16883787.48
2013;28-300358;YURA;  MUNICIPALIDAD DISTRITAL DE YURA;AREQUIPA;AREQUIPA;040128;8.792410421;15549797.23;77.15518053;;0.530993405;706.7516489;1;;82.2802384;23420.5;;17029957.8
2013;07-300366;QUILCA;  MUNICIPALIDAD DISTRITAL DE QUILCA;CAMANA;AREQUIPA;040207;8.409669792;244567.5;83.84877771;;0.526939953;673.5954298;1;;71.31842093;692.5;;261279.39
2013;08-300375;CHAPARRA;  MUNICIPALIDAD DISTRITAL DE CHAPARRA;CARAVELI;AREQUIPA;040308;9.420124397;2006494.24;85.31068266;;0.568782288;870.8036667;;1;55.34103679;5082.5;;2265489.89
2013;09-300376;HUANUHUANU;  MUNICIPALIDAD DISTRITAL DE HUANUHUANU;CARAVELI;AREQUIPA;040309;8.521415871;1467596.62;87.33404916;;0.535051675;734.7557288;;1;62.0161079;3125;;1785713.4
2013;09-300389;ORCOPAMPA;  MUNICIPALIDAD DISTRITAL DE ORCOPAMPA;CASTILLA;AREQUIPA;040409;9.242630159;3159183.83;76.71044;;0.535609708;930.0201609;;1;46.15104032;9447.5;;4722309.53
2013;04-300398;CALLALLI;  MUNICIPALIDAD DISTRITAL DE CALLALLI;CAYLLOMA;AREQUIPA;040504;6.235245272;822330.05;81.30386256;;0.415381676;477.7322671;1;;61.83477621;2106.5;;889939.89
2013;16-300410;TAPAY;  MUNICIPALIDAD DISTRITAL DE TAPAY;CAYLLOMA;AREQUIPA;040516;5.327867499;215868.86;78.62286335;;0.369595046;419.3296547;;1;88.02578619;571;;233597.24
2013;03-300417;CAYARANI;  MUNICIPALIDAD DISTRITAL DE CAYARANI;CONDESUYOS;AREQUIPA;040603;7.583908505;1540284.94;86.36435575;;0.462316296;694.4078662;;1;33.99473694;3278.5;;3175591.16
2013;06-300420;RIO GRANDE;  MUNICIPALIDAD DISTRITAL DE RIO GRANDE;CONDESUYOS;AREQUIPA;040606;9.042429303;1139676.34;74.39481563;;0.585173246;992.1008282;;1;78.28361505;2894.5;;1356974.81
2013;06-300513;OYOLO;  MUNICIPALIDAD DISTRITAL DE OYOLO;PAUCAR DEL SARA SARA;AYACUCHO;050806;7.308107246;17460.05;63.05276541;;0.239337655;298.7011755;;1;14.78325156;1190.5;;22561.94
2013;05-300533;CANARIA;  MUNICIPALIDAD DISTRITAL DE CANARIA;VICTOR FAJARDO;AYACUCHO;051005;6.789162162;136388.38;72.98031193;;0.385448013;520.1057079;;1;38.57479266;4011;;364339.3
2013;08-300604;YONAN;  MUNICIPALIDAD DISTRITAL DE YONAN;CONTUMAZA;CAJAMARCA;060508;7.797130295;1479716.62;72.67682153;;0.509456858;878.2512834;1;;56.08927798;7982;;1705784.09
2013;09-300674;SEXI;  MUNICIPALIDAD DISTRITAL DE SEXI;SANTA CRUZ;CAJAMARCA;061309;6.927769196;655283.6;75.63314339;;0.417407413;464.0872827;1;;71.28304481;564;;686758.48
2013;07-300746;SUYCKUTAMBO;  MUNICIPALIDAD DISTRITAL DE SUYCKUTAMBO;ESPINAR;CUSCO;080807;4.074640812;336184.78;71.92285041;;0.275862004;289.2039166;;1;43.44066292;2812;;3556424.81
2013;06-300797;HUACHOCOLPA;  MUNICIPALIDAD DISTRITAL DE HUACHOCOLPA;HUANCAVELICA;HUANCAVELICA;090106;6.926314965;202782.7;65.06594374;;0.397692278;735.4136066;;1;30.92402131;2929;;413267.93
2013;04-300820;CCOCHACCASA;  MUNICIPALIDAD DISTRITAL DE CCOCHACCASA;ANGARAES;HUANCAVELICA;090304;5.678875458;436929.67;64.97340831;;0.323719671;421.9327212;;1;38.88672853;2895.5;;796699.14
2013;09-300850;SAN PEDRO DE CORIS;  MUNICIPALIDAD DISTRITAL DE SAN PEDRO DE CORIS;CHURCAMPA;HUANCAVELICA;090509;7.25829703;39752.46;61.415829;;0.412857976;741.1757269;;1;43.11737718;3887;;498464.37
2013;03-300887;CHINCHAO;  MUNICIPALIDAD DISTRITAL DE CHINCHAO;HUANUCO;HUANUCO;100103;3.605393608;15489.17;77.15999899;;0.248204845;299.4714603;1;;21.88161659;26076;;35517.48
2013;07-300952;SAN MIGUEL DE CAURI;  MUNICIPALIDAD DISTRITAL DE SAN MIGUEL DE CAURI;LAURICOCHA;HUANUCO;101007;7.237632075;179619.56;69.03538933;;0.366356338;483.4202721;;1;37.01416659;10310.5;;547326.91
2013;03-300976;CHAVIN;  MUNICIPALIDAD DISTRITAL DE CHAVIN;CHINCHA;ICA;110203;8.899296977;4131543.84;79.4362699;;0.487501414;737.5633063;;1;41.00391473;1357.5;;4185828.47
2013;05-300989;VISTA ALEGRE;  MUNICIPALIDAD DISTRITAL DE VISTA ALEGRE;NASCA;ICA;110305;9.39187457;10370400.09;83.80195794;;0.53486618;651.3647923;;1;74.08819796;15156.5;;12692433.53
2013;05-300999;PARACAS;  MUNICIPALIDAD DISTRITAL DE PARACAS;PISCO;ICA;110505;10.0576152;990132.7;76.47020552;;0.536278014;816.2938356;1;;56.49405352;6365.5;1;1220979.5
2013;07-301001;SAN CLEMENTE;  MUNICIPALIDAD DISTRITAL DE SAN CLEMENTE;PISCO;ICA;110507;9.123111137;2960507.43;76.16148158;;0.498842412;668.8371971;1;;62.92757838;21411.5;;3617104.82
2013;12-301010;COLCA;  MUNICIPALIDAD DISTRITAL DE COLCA;HUANCAYO;JUNIN;120112;7.213058043;76023.52;71.34326631;;0.371935762;400.9053987;1;;64.98240355;2066.5;;108956.45
2013;06-301051;VITOC;  MUNICIPALIDAD DISTRITAL DE VITOC;CHANCHAMAYO;JUNIN;120306;7.780812575;48687.67;72.45797574;;0.504706895;885.8274332;;1;52.73263361;2042;;282485.36
2013;06-301057;CURICACA;  MUNICIPALIDAD DISTRITAL DE CURICACA;JAUJA;JUNIN;120406;7.131552513;65217.06;67.60143808;;0.41062225;541.5743629;1;;60.70391402;1682.5;;85193.57
2013;05-301102;LA UNION;  MUNICIPALIDAD DISTRITAL DE LA UNION;TARMA;JUNIN;120705;7.614939757;280588.9;76.57971032;;0.451991676;543.1165389;1;;66.63595186;3371;;431753.72
2013;01-301108;LA OROYA;  MUNICIPALIDAD PROVINCIAL DE YAULI - LA OROYA;YAULI;JUNIN;120801;10.30129288;3556849.27;75.1597212;1;0.597347738;978.4793771;;;74.15881112;14681.5;;4613752.33
2013;03-301110;HUAY-HUAY;  MUNICIPALIDAD DISTRITAL DE HUAY - HUAY;YAULI;JUNIN;120803;9.78799291;3304936.48;78.50086897;;0.54694823;894.6838987;;1;49.37959989;1544;;4821760.36
2013;04-301111;MARCAPOMACOCHA;  MUNICIPALIDAD DISTRITAL DE MARCAPOMACOCHA;YAULI;JUNIN;120804;7.917609775;932898.43;77.98513596;;0.474020158;667.5418872;1;;52.04940054;1297;;1206431.96
2013;10-301117;YAULI;  MUNICIPALIDAD DISTRITAL DE YAULI;YAULI;JUNIN;120810;10.4718305;3985673.61;75.92810066;;0.634565394;1162.764683;1;1;71.16193621;5405.5;;6527727.67
2013;01-301171;SAN PEDRO DE LLOC;  MUNICIPALIDAD PROVINCIAL DE PACASMAYO - SAN PEDRO DE LLOC;PACASMAYO;LA LIBERTAD;130701;9.59636192;2179354.46;79.66748938;;0.546253972;781.2075342;1;;64.46265713;16599.5;;2364132.8
2013;09-301184;PATAZ;  MUNICIPALIDAD DISTRITAL DE PATAZ;PATAZ;LA LIBERTAD;130809;7.057356872;5701248.51;70.81694586;;0.361278094;527.326674;;1;27.45789189;8602;;7306938.67
2013;02-301206;LUCMA;  MUNICIPALIDAD DISTRITAL DE LUCMA;GRAN CHIMU;LA LIBERTAD;131102;5.210746601;1306438.01;71.74963604;;0.214677481;187.2794652;1;;21.14754747;6730;;1416300.29
2013;03-301211;GUADALUPITO;  MUNICIPALIDAD DISTRITAL DE GUADALUPITO;VIRU;LA LIBERTAD;131203;6.116178747;1185688.06;75.97606874;;0.395297826;526.6479213;1;;45.85426181;8924;;1284545.25
2013;04-301235;MANUEL ANTONIO MESONES MURO;  MUNICIPALIDAD DISTRITAL DE MANUEL ANTONIO MESONES MURO;FERREÑAFE;LAMBAYEQUE;140204;6.75622409;450.83;68.31290332;;0.391211011;496.2620293;1;;57.24706664;4268.5;;450.83
2013;06-301255;CARABAYLLO;  MUNICIPALIDAD DISTRITAL DE CARABAYLLO;LIMA;LIMA;150106;10.00666196;260180.73;78.74104448;;0.5896006;906.4915743;1;;73.53201433;284969.5;;365184.67
2013;18-301267;LURIGANCHO;  MUNICIPALIDAD DISTRITAL DE LURIGANCHO (CHOSICA);LIMA;LIMA;150118;10.46342435;298839.53;79.65818399;;0.627192028;1021.598473;;;75.81293261;210112;1;430328
2013;19-301268;LURIN;  MUNICIPALIDAD DISTRITAL DE LURIN;LIMA;LIMA;150119;9.951253035;227423.9;79.06885486;;0.617146567;1049.723134;1;;70.89795529;81003;;349886.8
2013;23-301272;PACHACAMAC;  MUNICIPALIDAD DISTRITAL DE PACHACAMAC;LIMA;LIMA;150123;9.675899636;183462.84;78.05125065;;0.573874279;902.9461383;1;;67.62054436;116172;;276454.31
2013;43-301292;VILLA MARIA DEL TRIUNFO;  MUNICIPALIDAD DISTRITAL DE VILLA MARIA DEL TRIUNFO;LIMA;LIMA;150143;9.990917603;692951.42;79.77882574;;0.617733865;1014.50662;1;;74.15966718;437503.5;;1005313.17
2013;02-301312;ASIA;  MUNICIPALIDAD DISTRITAL DE ASIA;CAÑETE;LIMA;150502;9.152250305;796713.52;79.26879364;;0.572773011;944.9084161;1;;61.94637759;8796;;1042605.83
2013;05-301315;CHILCA;  MUNICIPALIDAD DISTRITAL DE CHILCA;CAÑETE;LIMA;150505;9.856690889;1222503.09;80.03160765;;0.597836909;1015.251643;1;;60.95027129;15659;;1505199.65
2013;06-301316;COAYLLO;  MUNICIPALIDAD DISTRITAL DE COAYLLO;CAÑETE;LIMA;150506;7.808012929;346633.18;84.70722307;;0.544807125;721.137735;;1;85.80337892;1079;;736000.94
2013;01-301327;HUARAL;  MUNICIPALIDAD PROVINCIAL DE HUARAL;HUARAL;LIMA;150601;9.098253156;4852704.52;80.26980579;;0.569846404;867.4865227;;1;69.91383768;98711;;6404194.39
2013;10-301336;SANTA CRUZ DE ANDAMARCA;  MUNICIPALIDAD DISTRITAL DE SANTA CRUZ DE ANDAMARCA;HUARAL;LIMA;150610;8.783309921;112670.97;79.08274384;;0.460046982;500.6346356;;1;68.68211493;1378;;145243.11
2013;05-301343;CHICLA;  MUNICIPALIDAD DISTRITAL DE CHICLA;HUAROCHIRI;LIMA;150705;10.25900414;1803614.96;71.8969728;;0.672718186;1569.231762;;1;65.81799653;7607;;3033004.42
2013;16-301354;SAN ANTONIO;  MUNICIPALIDAD DISTRITAL DE SAN ANTONIO;HUAROCHIRI;LIMA;150716;7.978369134;868802.14;72.21349718;;0.326938252;273.4893419;1;;64.17179791;5324.5;;1210878.35
2013;22-301360;SAN MATEO;  MUNICIPALIDAD DISTRITAL DE SAN MATEO;HUAROCHIRI;LIMA;150722;9.496672998;309772.72;70.92736562;;0.5513996;926.1838448;;1;68.27408423;5119.5;;544042.13
2013;01-301371;HUACHO;  MUNICIPALIDAD PROVINCIAL DE HUAURA;HUAURA;LIMA;150801;11.78387675;1541297.29;78.04499666;;0.651105533;1053.457275;1;;81.86181045;58318.5;;2058679.45
